Name,ASIN,Region,Description,Breakdown,Price,Deal Price,You saved,Rating,Rating count,Availability,Hyperlink,Store
"Luxspire Borsa Cosmetica, Borsetto Cosmetico Portatile Professionale per Trucco per Viaggio, Artisti Bagaglio Spazzole Borsa Bagagliaio Organizer Tool con Divisori Regolabili - Nero",B075YRKDN1,Italy,"MATERIALE PREMIUM - La custodia per make-up è realizzata con materiali ultra resistenti come il polistiere rende la custodia resistente a urti e al usura quotidiana. Dimensioni: 10.23"" x 9.44"" x 3.9"" (26 x 24 x 10 cm). AMPIA APPLICAZIONE - Porta cosmetici ha multi scomparti di diverse grandezze ed facilmente regolabili a seconda degli accessori da inserire come cosmetici come rossetti, set di pennelli cosmetici, e altri accessori, con la tracolla inserite e il manico laterale rende la borsa facilmente portatile tutti I tuoi cosmetici on ogni occasione. MULTI TASCHE REGOLABILI - La borsa realizzata con 2 tasche ampie sul coperchio e le diverse tasche con lo scompartimenti in Eva facilmente rimovibili ed regolabili a diverse misura a seconda dei tuoi accessori. DOPPIA CHIUSURA - La doppia chiusura della borsa assicura un accesso comodo ed immediato a tutti gli accessori in un attimo.È comodo e veloce da usare, non sono necessari programmi aggiuntivi. TRASPORTATILE - La maniglia laterale durevole e la tracolla rendono la borsa per cosmetici facile da trasportare, che può essere portata sulla mano o sulla spalla. Facile da trasportare, molto adatto per viaggi d'affari, viaggi, ecc. Perfetto come regalo di San Valentino per un'amica, fidanzata, ecc.",,"28,95",N/A,N/A,N/A,N/A,In stock,https://www.amazon.it/Luxspire-Cosmetica-Professionale-Bagagliaio-Regolabili/dp/B075YRKDN1/ref=sr_1_230?keywords=cosmetics&qid=1701830902&sr=8-230,Visita lo Store di Luxspire
Somatoline Cosmetic Som0100023/2 Deo Spray Ipersudorazione - 125 Ml,B06XHMQY89,Italy,"La sua formula integra una tecnologia a rilascio prolungato: le microsfere attive Essa rilascia i suoi attivi in modo continuo, controlla la traspirazione delle ghiadole sudoripare e riduce l'ipersudorazione Formato 125 ml",Marchio   Somatoline Forma articolo   Nebulizzatore Fragranza   Senza profumazione Numero di articoli   1 Conteggio unità   125.0 millilitro Volume articolo   125 Millilitri,Pagina1di1,N/A,N/A,N/A,N/A,In stock,https://www.amazon.it/Somatoline-Cosmetic-Som0100023-Spray-Ipersudorazione/dp/B06XHMQY89/ref=sr_1_231?keywords=cosmetics&qid=1701830902&sr=8-231,Marca: Somatoline
"Neve Cosmetics cipria Flat Perfection compatta opacizzante effetto bronzer con specchietto incorporato| ""Velvet Bronze""",B086XFM2T3,Italy,Cipria/bronzer in polvere pressata impalpabile e profumata. Il suo delicato tono abbronzato contrasta il pallore restituendo la tonalità radiosa delle vacanze. Ideale per fissare o ravvivare il makeup donando alla pelle un finish morbidissimo e vellutato. Il tutto in un packaging elegantissimo con specchio incorporato ispirato alle pietre dei giardini zen.,"Marchio   Neve Cosmetics Forma articolo   Pressata Colore   Velvet Bronze Tipo di pelle   Tutti i tipi di pelle Copertura   Leggera Vantaggi del prodotto   Uniforma l'incarnato, Minimizza la lucidità, Minimizza i pori Numero di articoli   1 Tonalità della pelle   Tutte le tonalità di pelle Caratteristica del materiale   Vegano, Naturale","13,96",N/A,N/A,N/A,N/A,In stock,https://www.amazon.it/Cipria-Perfection-Velvet-Neve-Cosmetics/dp/B086XFM2T3/ref=sr_1_232?keywords=cosmetics&qid=1701830902&sr=8-232,Marca: Neve Cosmetics
oyster cosmetics Sublime Fruit Maschera Idratante Al Latte - 1000 ml,B08LP4Z1VV,Italy,Sublime è la linea di prodotti oyster professional pensata con un approccio legato al beneficio e non al problema Il latte è un toccasana per la salute dei capelli che stimola i follicoli piliferi rendendo la chioma più sana e lucente e ne incentiva la crescita sia in termini di lunghezza sia di volume Un rimedio naturale per capelli crespi e aridisenza rovinare e stressare il capello Nome della fragranza: sweet,Marchio   oyster cosmetics Forma articolo   Balsamo Caratteristica del materiale   Naturale Tipo di capelli   Secchi Vantaggi del prodotto   Idratante,"9,40","9,40","8,93€",N/A,N/A,In stock,https://www.amazon.it/oyster-cosmetics-Sublime-Maschera-Idratante/dp/B08LP4Z1VV/ref=sr_1_233?keywords=cosmetics&qid=1701830902&sr=8-233,Marca: oyster cosmetics
e.l.f. Cosmetics - The New Classics Eyeshadow Palette | Palette di ombretti cremosi dalle moderne tonalità neutre,B07WMBCY2C,Italy,"Incontra i nuovi classici ! Questa palette da 18 porzioni contiene una selezione curata di tonalità essenziali opache, satinate e brillanti per ottenere qualsiasi look occhi neutro. La formula di lusso di questa palette di ombretti neutri è liscia, cremosa, sfumabile e ultra pigmentata per un'applicazione senza sforzo. Tutti gli elfi i prodotti sono Vegan e Cruelty Free. Questo prodotto è realizzato in una fabbrica certificata Fair Trade",Marchio   e.l.f. Forma articolo   Polvere Numero di articoli   1 Conteggio unità   164.0 grammo Copertura   Leggera Peso articolo   18 grammi Dimensioni articolo: LxPxA   33 x 257 x 498 mm Informazioni pacco   Palette Tipo di pacco   Scatola Caratteristica del materiale   Cruelty free,"19,95",N/A,N/A,N/A,N/A,In stock,https://www.amazon.it/l-f-Cosmetics-Classics-Eyeshadow-ombretti/dp/B07WMBCY2C/ref=sr_1_234?keywords=cosmetics&qid=1701830902&sr=8-234,Marca: e.l.f.
e.l.f. cosmetics - Bite Size Face Duo | Mini fard e illuminanti compatti per una pelle luminosa | Pomegranate,B08T79Q8VS,Italy,Duo di fard e illuminante leggermente pigmentati per esaltare la tua luminosità naturale mentre sei in movimento. Colore cremoso e sfumabile Sembra fantastico su tutte le tonalità della pelle Dimensioni perfette quando sei in movimento,Marchio   e.l.f. Conteggio unità   1 unità Caratteristica del materiale   Naturale Peso articolo   1 grammi Dimensioni articolo: LxPxA   10 x 34 x 90 mm Tipo di pacco   Palette,"9,95",N/A,N/A,N/A,N/A,In stock,https://www.amazon.it/l-f-cosmetics-illuminanti-compatti-Pomegranate/dp/B08T79Q8VS/ref=sr_1_235?keywords=cosmetics&qid=1701830902&sr=8-235,Marca: e.l.f.
"GYADA COSMETICS, Patch Occhi Rimpolpante, Effetto Lifting, con Peptidi Biomedici, Adatto a Tutti i Tipi di Pelle, Indicato per Contorno Occhi Segnato, 5 ml",B07PN4GSMP,Italy,"PATCH OCCHI: Per ogni tipo di pelle, ideale per zona contorno occhi molto segnata. Formulati con una combinazione di peptidi biomimetici che aiutano il trattamento cosmetico dei segni di espressione PROPRIETA': Patch occhi in cellulosa 100% naturale ad azione liftante e rimpolpante per zona contorno occhi molto segnata INGREDIENTI: A base di Peptidi Biomedici MODO D'USO: La busta contiene due patch, uno per occhio. Applica sulla zona perioculare, lascia in posa per 15 minuti. Rimuovi e fai assorbire il prodotto residuo con un massaggio fino ad assorbimento GYADA COSMETICS: Cosmetici di alta qualità, creati attraverso l’utilizzo di formulazioni esclusivamente naturali, a base di estratti vegetali e biologici",Marchio   GYADA COSMETICS Vantaggi del prodotto   Rimpolpante Tipo di pelle   Tutti i tipi di pelle Caratteristica speciale   Alcohol-Free Conteggio unità   3 unità Numero di articoli   1 Ingredienti attivi   peptidi Da utilizzare per   Occhi Volume articolo   5 Millilitri,"5,30","5,30","0,60€",N/A,N/A,In stock,https://www.amazon.it/GYADA-COSMETICS-Rimpolpante-Biomedici-Indicato/dp/B07PN4GSMP/ref=sr_1_236?keywords=cosmetics&qid=1701830902&sr=8-236,Visita lo Store di GYADA COSMETICS
Mulac Cosmetics LIP SIN 04 DAIQUIRI RED lip stain lucida rosso desaturato Vegan 4 ml,B0CN7F3LCP,Italy,LIP SIN 04 DAIQUIRI RED VEGAN Rosso Lucido,Marchio   Mulac Forma articolo   Liquido Numero di articoli   1,Pagina1di1,N/A,N/A,N/A,N/A,In stock,https://www.amazon.it/Mulac-Cosmetics-DAIQUIRI-lucida-desaturato/dp/B0CN7F3LCP/ref=sr_1_237?keywords=cosmetics&qid=1701830902&sr=8-237,Marca: Mulac
Mulac Cosmetics BFF Pressed Powder 01 LIGHT Cipria Compatta Setificante Vegan 7.5 gr,B0CL7SQFNV,Italy,BFF PERFECTING PRESSED POWDER 01 LIGHT VEGAN FORMULA,Marchio   Generico Forma articolo   Pressata Numero di articoli   1 Caratteristica del materiale   Vegano,Pagina1di1,N/A,N/A,N/A,N/A,In stock,https://www.amazon.it/Cosmetics-Pressed-Powder-Compatta-Setificante/dp/B0CL7SQFNV/ref=sr_1_238?keywords=cosmetics&qid=1701830902&sr=8-238,Marca: Generico
"reisenthel Wrapcosmetic Modern, Einheitsgröße",B08WDJ8NNF,Italy,,,,N/A,N/A,N/A,N/A,In stock,https://www.amazon.it/reisenthel-wrapcosmetic-Accessori-viaggio-personale/dp/B08WDJ8NNF/ref=sr_1_239?keywords=cosmetics&qid=1701830902&sr=8-239,N/A
Mulac Cosmetics BFF Best Face Forever Fondotinta Cremoso tonalità porcellana 1N Brigitte Vegan 30 ml,B0C82XZLS8,Italy,VEGAN FORMULA Tonalità Porcellana Sottotono neutro long lasting,Forma articolo   Crema Marchio   Mulac Copertura   Media Numero di articoli   1 Conteggio unità   30.0 millilitro,Pagina1di1,N/A,N/A,N/A,N/A,In stock,https://www.amazon.it/Mulac-Cosmetics-Fondotinta-tonalit%C3%A0-porcellana/dp/B0C82XZLS8/ref=sr_1_240?keywords=cosmetics&qid=1701830902&sr=8-240,Marca: Mulac
MAC Cosmetics Colour Excess GEL PENCIL EYE LINER Crayon Gel GRAPHIC CONTENT 35gr,B0BKR6T5QX,Italy,Tenuta fino a 24+ ore sulle palpebre Tenuta fino a 12 ore nella rima interna Scorrevole Waterproof Non sbava,Marchio   Generico Forma articolo   Matita Caratteristica speciale   Waterproof Vantaggi del prodotto   Waterproof Numero di articoli   1 Conteggio unità   1 unità Informazioni pacco   Penna,Pagina1di1,N/A,N/A,N/A,N/A,In stock,https://www.amazon.it/Cosmetics-Colour-Excess-GRAPHIC-CONTENT/dp/B0BKR6T5QX/ref=sr_1_241?keywords=cosmetics&qid=1701830902&sr=8-241,Marca: MAC
Lola Cosmetics Creme de Pentear Ela É Carioca 3ABC Lola Cosmetics - 480gr,B0BDN1DN6H,Italy,,Volume liquido   8 Once fluide Forma articolo   Crema Marchio   Lola Cosmetics Conteggio unità   30.0 grammo,"12,95",N/A,N/A,N/A,N/A,In stock,https://www.amazon.it/Lola-Cosmetics-Creme-Pentear-Carioca/dp/B0BDN1DN6H/ref=sr_1_242?keywords=cosmetics&qid=1701830902&sr=8-242,Marca: Lola
"Eveline Cosmetics Fondotinta viso Liquid Control HD Matte, 32 ml, 015 Light Vanilla",B079BTNQ7N,Italy,"Una formula perfettamente leggera che non ostruisce i pori e non contiene eccessivamente la pelle La pipetta semplifica l'applicazione e copre la pelle ancora meglio La fondazione rimane sulla pelle per un massimo di 24 ore e offre una copertura media La pelle sembra vellutata, ma può anche respirare: la fondazione si trova sul viso come una seconda pelle La fondazione è racchiusa in imballaggi lussuosi: il vetro smerigliato spesso protegge dalla luce solare",Forma articolo   Liquido Colore   015 LIGHT VANILLA Tipo di pelle   Grassa Marchio   Eveline Cosmetics Copertura   Leggera Tonalità della pelle   Chiara Caratteristica speciale   Aromaterapia Dimensioni articolo: LxPxA   30 x 30 x 110 mm Numero di articoli   1 Conteggio unità   128.75 grammo,Pagina1di1,N/A,N/A,N/A,N/A,In stock,https://www.amazon.it/Eveline-Cosmetics-Fondotinta-Control-Vanilla/dp/B079BTNQ7N/ref=sr_1_243?keywords=cosmetics&qid=1701830902&sr=8-243,Marca: Eveline Cosmetics
"Neve Cosmetics fondotinta liquido Cream-To-Serum, fondotinta multisensoriale elastico e stratificabile a piacere | ""Tan Warm""",B0CKZ2G9G4,Italy,"Tonalità scura dal sottotono caldo e mediterraneo. Fondotinta in crema/siero effetto pelle sana e luminosa. Ideale per pelli bisognose di cura e morbidezza. Vegano, vegetariano, arricchito con estratti di anguria, lenticchia e mela. Agitare bene prima dell'uso!","Forma articolo   Liquido Colore   Beige Tipo di pelle   Sensibile, Normale, Mista, Secca Marchio   Neve Cosmetics Copertura   Media Vantaggi del prodotto   Correzione del colore, Rivitalizzante, Idratante Tonalità della pelle   Medio scura Fascia d'età (descrizione)   Adulti Caratteristica speciale   Leggero Peso articolo   55 Grammi","17,90",N/A,N/A,N/A,N/A,In stock,https://www.amazon.it/Neve-Cosmetics-fondotinta-multisensoriale-stratificabile/dp/B0CKZ2G9G4/ref=sr_1_244?keywords=cosmetics&qid=1701830902&sr=8-244,Marca: Neve Cosmetics
Cosmetics Marketing: Strategy and Innovation in the Beauty Industry,135029943X,Italy,,,"39,85",N/A,N/A,N/A,N/A,In stock,https://www.amazon.it/Cosmetics-Marketing-Strategy-Innovation-Industry/dp/135029943X/ref=sr_1_245?keywords=cosmetics&qid=1701830902&sr=8-245,N/A
The Vintage Cosmetic Company Baby Bunny Twist Make-up Headband Super-Soft Fabric Pink Polka Dot Design,B094DK41LK,Italy,"Perfect for keeping hair strands away from your face as you apply make-up & face-masks Use in the shower, bath, spa, steam-room, hair salon or gym - any place where you would need to neatly keep your hair tucked in place Made from super soft polyester toweling fabric with an elastic band and wire bunny ears that fits nice and snug on the forehead and around your head Designed to comfortably fit on the forehead and around the head. This Baby Bunny headband will make a wonderful addition to your beauty regimen This design is cute and feminine and can be used by women, teens, tweens, and girls",Colore   Pink Materiale   Poliestere Tipo di tessuto   Poliestere Numero di articoli   1 Usi consigliati per il prodotto   Per il viso Peso articolo   48 Grammi Marchio   The Vintage Cosmetic Company Taglia   1 unità (Confezione da 1) Conteggio unità   1.00 unità,"9,99",N/A,N/A,N/A,N/A,In stock,https://www.amazon.it/Vintage-Cosmetic-Company-Headband-Super-Soft/dp/B094DK41LK/ref=sr_1_246?keywords=cosmetics&qid=1701830902&sr=8-246,Marca: The Vintage Cosmetic Company
"GYADA COSMETICS, Radiance Dry Skin Face Cream, Crema Viso Illuminante Pelli Secche, Azione Antiossidante e Idratante, Contrasta i Segni dell'Età e d'Espressione, a Base di Vitamina C, 50 ml",B082N24MXL,Italy,"CREMA VISO: Crema illuminante per pelli miste-secche e spente. Migliora l’idratazione cutanea ed aiuta a trattare le desquamazioni. Antiossidante. Protegge dallo stress ossidativo PROPRIETÀ: Contribuisce a trattare le iperpigmentazioni legate all’invecchiamento, le discromie cutanee, i segni d’espressione, l’eccesso di sebo. Stimola la produzione di collagene ed elastina INGREDIENTI: Contiene Vitamina C, Acido Mandelico, Acido Lattobionico, Acido Ferulico, Melograno, Bacche di Goji, Uva Ursina MODO D'USO: Applicare mattina e sera su viso pulito. Si consiglia l’uso in combinazione con i prodotti della Linea Radiance Vitamin C GYADA COSMETICS: Cosmetici di alta qualità, creati attraverso l’utilizzo di formulazioni esclusivamente naturali, a base di estratti vegetali e biologici",Marchio   GYADA COSMETICS Forma articolo   Crema Ingredienti attivi   vitamina c Conteggio unità   50.0 millilitro Numero di articoli   1 Da utilizzare per   Faccia Tipo di pelle   Secca Volume articolo   50 Millilitri Vantaggi del prodotto   Idratante Caratteristica speciale   Alcohol-Free,"29,99","29,99","26,99€",N/A,N/A,In stock,https://www.amazon.it/GYADA-COSMETICS-Illuminante-Antiossidante-dEspressione/dp/B082N24MXL/ref=sr_1_247?keywords=cosmetics&qid=1701830902&sr=8-247,Visita lo Store di GYADA COSMETICS
"Giovanni Cosmetics Direct Leave-In Conditioner, 314 G , (1Er Pack)",B00CQ8260G,Italy,"item_display_weight; 0,314 kg",Marchio   Giovanni Forma articolo   Crema Tipo di capelli   Secchi Vantaggi del prodotto   Morbido Fascia d'età (descrizione)   Adulti,"23,20",N/A,N/A,N/A,N/A,In stock,https://www.amazon.it/Giovanni-Ammorbidente-Idratante-Risciacquo-Direct/dp/B00CQ8260G/ref=sr_1_248?keywords=cosmetics&qid=1701830902&sr=8-248,Marca: Giovanni
"GYADA COSMETICS, Maschera Viso Tonificante Effetto Freddo, Energizzante, Rinfrescante, Rende la Pelle Compatta ed Elastica, Per Tutti i Tipi di Pelle, Formula a Base di Zenzero e Limone, 75 ml",B08ZK9RVR7,Italy,"MASCHERA VISO: Maschera viso, dall’effetto freddo, a base di ingredienti con proprietà tonificanti, energizzanti e rinfrescanti. Per tutti i tipi di pelle, soprattutto quelle più rilassate PROPRIETÀ: Dona alla pelle una sensazione di comfort grazie alla texture morbida e cremosa. Svolge azione tonificante. La pelle apparirà più morbida, idratata, compatta ed elastica INGREDIENTI: Contiene Menta dall’effetto tonificante naturale, Zenzero dall’azione anti-age e ringiovanente, Limone, Pompelmo e Arancio Dolce dal potere antiossidante, Olio di Oliva MODO D'USO: Applicala su pelle pulita e asciutta con Mask Brush, il Pennello per Maschera Viso. Tieni in posa la maschera per 15 minuti e risciacqua GYADA COSMETICS: Cosmetici di alta qualità, creati attraverso l’utilizzo di formulazioni esclusivamente naturali, a base di estratti vegetali e biologici","Marchio   GYADA COSMETICS Forma articolo   Crema Vantaggi del prodotto   Rinfrescante,Ringiovanente,Tonificante Fragranza   Zenzero Tipo di pelle   Tutti i tipi di pelle Caratteristica speciale   Non testato sugli animali Conteggio unità   75.0 millilitro Numero di articoli   1 Usi consigliati per il prodotto   Viso Volume articolo   75 Millilitri","10,99","10,99","9,89€",N/A,N/A,In stock,https://www.amazon.it/GYADA-COSMETICS-Maschera-Tonificante-Effetto/dp/B08ZK9RVR7/ref=sr_1_249?keywords=cosmetics&qid=1701830902&sr=8-249,Visita lo Store di GYADA COSMETICS
"Palette Ombretti Opaco Cosmetics, Afflano Matte Eyeshadow Palette 35 Colori,Professionali Nude Trucco Occhi Eye Shadow Beauty Makeup,Shimmer Ombretto Opaco Naturale Brillanti Pigmentazione Polvere",B075XF4VDP,Italy,"❤【Pigmentazione Palette Di Ombretti 】Ombretti opaco e ombretto brillante creati con ingredienti di altissima qualità e la più aggiornata formula ultra-micronizzata e lussuosamente pigmentata matte eyeshadow palette --Trucco occhi ombretti palette makeup ❤【Palette Di Ombretti Brillanti Di Lunga Durata】 La palette di ombretti opachi è morbida e molto facile da usare e tinge sulla pelle, ombretti opaco con eccellente duttilità, non sbiadisce per l'intera giornata. la palette di ombretti ti aiuta a mantenere il look migliore soprattutto in alcune occasioni importanti.--Occhi ombretti trucco palette makeup ❤【Renditi più affascinante】 La nostra tavolozza di ombretti non opaca ,e non formerà un fastidioso marchio di ombretti! Ogni ombretto può essere usato da solo, o mescolare luccichio con un Ombretti Opaco, rendere gli occhi più vividi, un senso tridimensionale ricco. Tavolozza ombretto opaco adatto a tutti i tipi di pelle--Makeup trucco occhi ombretti palette ❤【Richiesto Per Il Trucco Perfetto】 Ombretto dai colori sublimi, si fondono alla perfezione.Potete sperimentare aggiungendo un po 'd'acqua sui pennelli o la base è perfetta da applicare prima di indossare l'ombretto, per ottenere un aspetto più intenso--Palette ombretti trucco occhi makeup ❤【Garanzia di soddisfazione al 100%】 I nostri valori fondamentali sono la SODDISFAZIONE DEI CLIENTI EI PALETTE OMBRETTI SUPERIORI. Tutta matt palette di ombretti di funziona a lungo, puoi sentirti leggero e morbido che ti offre il miglior ritorno per i tuoi soldi. se per qualche motivo non sei soddisfatto del nostro prodotto ti garantiamo un rimborso completo senza problemi, contattaci se hai qualche domanda.--Occhi makeupTrucco Ombretti Palette",Colore   35 Colori Matt Palette Ombretti Marchio   Afflano Forma articolo   Polvere Vantaggi del prodotto   Illuminante Numero di articoli   1 Conteggio unità   1 unità Copertura   Leggera Informazioni pacco   Palette Tipo di pacco   Scatola Caratteristica del materiale   Naturale,"8,95",N/A,N/A,N/A,N/A,In stock,https://www.amazon.it/Cosmetics-Afflano-Eyeshadow-Professionali-Pigmentazione/dp/B075XF4VDP/ref=sr_1_250?keywords=cosmetics&qid=1701830902&sr=8-250,Visita lo Store di Afflano
Eveline Cosmetics 8 In 1 Total Action Intensive Crescita Rinforzante Nail Hardener Siero Silver Shine | 12 ml | Trattamento Riparatore Per Unghie Rotte E Fragili | Facile Applicazione,B07FFWSW7Y,Italy,"UNGHIE PIÙ FORTI E DURE - Un balsamo indurente di lusso con particelle d'argento permea la lamina ungueale, ricostruisce, rigenera e stimola la crescita delle unghie. PROTEZIONE CONTRO LA FRAGILE – Il balsamo protegge le unghie da screpolature, rotture e spaccature e aumenta la resistenza ai danni meccanici. EFFETTI IMMEDIATI - Già dopo 10 giorni di trattamento le unghie riacquistano una superficie uniforme, dura e una lucentezza deliziosa. CRESCITA PIÙ VELOCE DELLE UNGHIE - Ultra-Keratin è la formula di nuova generazione ispirata alla ricerca clinica, che stimola la produzione di cheratina dura, materiale da costruzione della lamina ungueale. GARANZIA DI RIMBORSO DI 30 GIORNI - Crediamo di avere il prodotto di altissima qualità sul mercato. Pertanto, il nostro prodotto è coperto da una garanzia di rimborso di 30 giorni che dimostra che siamo certi che ne sarai soddisfatto al 100%.","Marchio   Eveline Cosmetics Forma articolo   Balsamo Peso articolo   60 Grammi Volume liquido   12 Millilitri Specialità   Crescita,Rinforzante Numero di articoli   1 Conteggio unità   12 millilitro","9,92",N/A,N/A,N/A,N/A,In stock,https://www.amazon.it/Eveline-Cosmetics-Rinforzante-Trattamento-Applicazione/dp/B07FFWSW7Y/ref=sr_1_251?keywords=cosmetics&qid=1701830902&sr=8-251,Marca: Eveline Cosmetics
TINTARK Palette Ombretti 14 Colori Glitter Shimmer Metallic Occhi Ombretto Altamente Pigmentato Galaxy Eye Make up Blu Trucchi Palettes (Galactic Assemble),N/A,Italy,"Palette di ombretti: 30 colorati arcobaleno include 11 matte setosi, 5 glitter, 10 metallic, 2 glitter stellati, 2 sparkle. Incantevoli colori dell'arcobaleno! Palline luccicanti piene di divertimento! Questo ombretto a 30 colori ha un sacco di speciali palline effetto perlato, puoi combinare i colori come preferisci per rendere il tuo processo di trucco pieno di gioia. Facile da usare: fintanto che hai questa palette di ombretti con uno specchio quando esci, puoi applicare il trucco in qualsiasi momento senza cercare uno specchio aggiuntivo. Lunga durata e impermeabile: la formula impermeabile a lunga durata dell'ombretto mantiene il tuo ombretto perfetto per lungo tempo. Regalati un'esperienza confortevole. Sicuro, pulito e salutare: senza talco, cruelty-free, vegano, senza test sugli animali e senza ingredienti di origine animale, senza olio minerale, tutti i coloranti approvati da USA e EURO e imballaggi ecologici.","Colore   Galactic Assemble Marchio   Tintark Forma articolo   Polvere Caratteristica speciale   Impermeabile,Lunga Durata Vantaggi del prodotto   Setosi Numero di articoli   1 Conteggio unità   36.0 grammo Dimensioni articolo: LxPxA   18 x 17 x 3,7 cm Informazioni pacco   Palette Tipo di pacco   Scatola","25,99","25,99","23,99€",N/A,N/A,In stock,https://www.amazon.it/sspa/click?ie=UTF8&spc=MTo2ODUwNjgxNjU4ODAzNzA0OjE3MDE4MzA5MDI6c3BfYnRmOjMwMDA0NjUwMDg0MTkzMjo6MDo6&url=%2FOmbretti-Metallic-Altamente-Pigmentato-Space-like%2Fdp%2FB0BPGK16ZB%2Fref%3Dsr_1_252_sspa%3Fkeywords%3Dcosmetics%26qid%3D1701830902%26sr%3D8-252-spons%26sp_csd%3Dd2lkZ2V0TmFtZT1zcF9idGY%26psc%3D1,Visita lo Store di Tintark
"KORFF Cure Make Up Base Levigante, Primer Make Up con Acido Ialuronico",N/A,Italy,,"Marchio   Korff Vantaggi del prodotto     Corregge i rossori e le discromie cutanee; Uniforma l’incarnato, rendendo meno visibili le imperfezioni; Facilita la stesura del fondotinta, migliorandone la tenuta.   Mostra altro Forma articolo   Crema Tipo di pelle   Tutti i tipi di pelle Volume articolo   30 Millilitri Numero di articoli   1 Conteggio unità   30.0 grammo Peso articolo   100 Grammi","22,30",N/A,N/A,N/A,N/A,In stock,https://www.amazon.it/sspa/click?ie=UTF8&spc=MToyMDI2OTkyNzE5NzY4NzA0OjE3MDE4MzA5MDI6c3BfYXRmX25leHQ6MjAwNDkwMTM4Mzg0MDE6OjA6Og&url=%2FKorff-Anti-Rossore-Ialuronico-Levigata-lincarnato%2Fdp%2FB07TX6WLTF%2Fref%3Dsr_1_241_sspa%3Fkeywords%3Dcosmetics%26qid%3D1701830902%26sr%3D8-241-spons%26sp_csd%3Dd2lkZ2V0TmFtZT1zcF9hdGZfbmV4dA%26psc%3D1,N/A
"It Cosmetics Your Skin But Better CC - crema con SPF 50+, abbronzatura media",N/A,Italy,"Colore: Medium – Tan # 1 best-seller, premiato formula. Griglie color-correcting crema, anti-invecchiamento cura della pelle e SPF 50 + UVA/UVB ad ampio spettro Physical crema solare per la pelle, ma migliore Anti-aging peptidi, collagene idrolizzato, vitamine E antiossidanti",Marchio   IT Cosmetics Fragranza   Shea Butter Forma articolo   Crema Ingredienti attivi   peptidi Conteggio unità   12 millilitro Numero di articoli   1 Da utilizzare per   Faccia Tipo di pelle   Tutti i tipi di pelle Ingredienti speciali   Hyaluronic acid Volume articolo   32 Millilitri,"59,00",N/A,N/A,N/A,N/A,In stock,https://www.amazon.it/sspa/click?ie=UTF8&spc=MToyMDI2OTkyNzE5NzY4NzA0OjE3MDE4MzA5MDI6c3BfYXRmX25leHQ6MjAxMTg4OTA3Njk4OTg6OjA6Og&url=%2FCosmetics-your-Better-Cream-Medium%2Fdp%2FB071CMS2BD%2Fref%3Dsr_1_242_sspa%3Fkeywords%3Dcosmetics%26qid%3D1701830902%26sr%3D8-242-spons%26sp_csd%3Dd2lkZ2V0TmFtZT1zcF9hdGZfbmV4dA%26psc%3D1%26smid%3DA2WS6U4W1X5MB6,Marca: IT Cosmetics
