Name,ASIN,Region,Description,Breakdown,Price,Deal Price,You saved,Rating,Rating count,Availability,Hyperlink,Store
"Neve Cosmetics tinta labbra Ruby Juice, leggera come acqua resistente come inchiostro | ""Detective""",B0CKZFNH6P,Italy,"Marrone nocciola caldo matte. Tinta Labbra a base di acqua, effetto semi-permanente. Leggero, resistente e sottile sulle labbra. Stratificabile a piacere per intensificare il colore.","Marchio   Neve Cosmetics Colore   Detective Tipo di pelle   Tutti i tipi di pelle Forma articolo   Liquido Vantaggi del prodotto   Lunga durata Copertura   Completa Tonalità della pelle   Tutte le tonalità di pelle Dimensioni articolo: LxPxA   20 x 20 x 90 mm Caratteristica speciale   Lunga durata, Asciugatura rapida, Altamente pigmentato, Resistente ai trasferimenti null   Tinta labbra","14,90",N/A,N/A,N/A,N/A,In stock,https://www.amazon.it/Neve-Cosmetics-resistente-inchiostro-Detective/dp/B0CKZFNH6P/ref=sr_1_75?keywords=cosmetics&qid=1701830902&sr=8-75,Marca: Neve Cosmetics
e.l.f. Cosmetics Camo Color Corrector | Correttore del colore a lunga tenuta con acido ialuronico (Pesca),B0BSP38HYN,Italy,"Correttore colore giallo: mimetizza l'opacità nelle tonalità della pelle da giuste a medie. Correttore colore verde: copre arrossamenti, imperfezioni e guance rosee in tutte le tonalità della pelle. Correttore colore pesca: mimetizza le macchie e l'oscurità presenti sotto gli occhi nelle carnagioni da chiare a medie. Correttore colore arancione: mimetizza le macchie e l'oscurità che si trovano sotto gli occhi nelle carnagioni da abbronzate a ricche. Correttore colore blu: si mescola con il fondotinta e il correttore per compensare i toni eccessivamente caldi.","Forma articolo   Gel Colore   Pesca Marchio   e.l.f. Copertura   Totale Vantaggi del prodotto   Corregge le imperfezioni Dimensioni articolo: LxPxA   11 x 1,7 x 1,8 cm Conteggio unità   2.8 millilitro",Pagina1di1,N/A,N/A,N/A,N/A,In stock,https://www.amazon.it/l-f-Cosmetics-Corrector-Correttore-ialuronico/dp/B0BSP38HYN/ref=sr_1_76?keywords=cosmetics&qid=1701830902&sr=8-76,Marca: e.l.f.
"Aquaria Thermal Cosmetics Crema 24 Ore Idratante, 50 ml",B01BKDWQ34,Italy,"Crema multifunzione che idrata e protegge donando luminosità, flacone airless con 100 % Acqua di Terme di Sirmione, acido ialuronico, pantenolo, gel di alghe rosse, latte di riso e oli di mandorle dolci e jojoba Texture vellutata e delicata sulla pelle; fragranza delicata dalle dolci note fiorite, senza allergeni Applicare mattina e sera su viso e collo con piccoli movimenti rotatori, dal centro verso l'esterno Dermatologicamente testato; pH fisiologico; formula con estratti vegetali senza parabeni e petrolati",,"17,36","17,36","11,64€",N/A,N/A,In stock,https://www.amazon.it/Aquaria-Thermal-Cosmetics-Crema-Idratante/dp/B01BKDWQ34/ref=sr_1_77?keywords=cosmetics&qid=1701830902&sr=8-77,Marca: Terme di Sirmione
"Nabla Cupid's Arrow, Matita stylo multi-funzione a lunga tenuta dalla texture cremosa, Arrow #7 MAROON - 21 g",B0C66DYNFB,Italy,"Colore pieno in una sola passata. Eccellente scorrevolezza e precisione, con temperino integrato. Elegante design pouch friendly. Vegan Friendly. Cruelty Free.",Marchio   NABLA Cosmetics Colore   Marrone Tipo di pelle   Tutti i tipi di pelle Forma articolo   Pastello Vantaggi del prodotto   Crea i tuoi effetti sfumati o grafici con i Cupid's Arrow di Nabla! Copertura   Media Fascia d'età (descrizione)   Bambini Tonalità della pelle   Tutte le tonalità di pelle Numero di articoli   1,"16,09",N/A,N/A,N/A,N/A,In stock,https://www.amazon.it/Cupids-Matita-multi-funzione-texture-cremosa/dp/B0C66DYNFB/ref=sr_1_78?keywords=cosmetics&qid=1701830902&sr=8-78,Marca: NABLA Cosmetics
"Neve Cosmetics ArtDiary Palette, 12 ombretti per esplorare le sfumature della bellezza felina | ""Feline Dreams Palette""",B08L9P6QDQ,Italy,"Dodici ombretti dalle tonalità soft ed eleganti, per un make-up felino e accattivante. I colori sono versatili e modulabili, facili da sfumare; finish opaco e satinato, per regalare la giusta luminosità all'occhio. Una palette per chi vuole osare ma sempre rimanendo nella sua comfort zone. Colori facili da sfumare, si possono utilizzare sia da bagnati che da asciutti. Formato comodo e da portare dove vuoi, comprende uno specchio utile per tutti i ritocchi che desideri!",Colore   Feline Dreams Marchio   Neve Cosmetics Forma articolo   Striscia Vantaggi del prodotto   Colori intensi. Lunga durata. Numero di articoli   1 Conteggio unità   1 unità Copertura   Totale Tipo di pelle   Tutti i tipi di pelle Informazioni pacco   Palette Tipo di pacco   Scatola,"28,49",N/A,N/A,N/A,N/A,In stock,https://www.amazon.it/Neve-palette-ombretti-feline-dreams/dp/B08L9P6QDQ/ref=sr_1_79?keywords=cosmetics&qid=1701830902&sr=8-79,Marca: Neve Cosmetics
"Aquaria Thermal Cosmetics Tonico Idratante per il viso, 200 ml",B01BKDWPXU,Italy,"Il Tonico idratante di Terme di Sirmione è una lozione idratante, fresca e leggera Manterrà inalterato il grado di umidità della vostra pelle arrivando in profondità Con il 100% di Acqua di Terme di Sirmione e distillato di Rosa e Melissa e arricchito con estratti di Camomilla, Centella, Malva e Ginseng Senza allergeni Dermatologicamente testato; pH fisiologico; formula con estratti vegetali senza parabeni e petrolati",Marchio   Aquaria Thermal Cosmetics Forma articolo   200 Ml Tipo di pelle   Secca Vantaggi del prodotto   Idratante Fragranza   Rosa Volume articolo   200 Millilitri Peso articolo   247 Grammi Numero di articoli   1 Conteggio unità   200.0 millilitro,"10,08","10,08","9,07€",N/A,N/A,In stock,https://www.amazon.it/Aquaria-Thermal-Cosmetics-Tonico-Idratante/dp/B01BKDWPXU/ref=sr_1_80?keywords=cosmetics&qid=1701830902&sr=8-80,Marca: Terme di Sirmione
Wakeup Cosmetics Fondotinta Compatto,N/A,Italy,"Fondotinta cream-to-powder ad alta coprenza Aiuta a creare un effetto pelle luminosa per tutto il giorno Un effetto matte che minimizza le imperfezioni della pelle e dona un effetto no-make up Formulazione emolliente molto ricca, alta proprietà idratante e antiossidante Prodotto in Italia",Forma articolo   crema polvere Colore   C2 Tipo di pelle   Tutti i tipi di pelle Usi consigliati per il prodotto   Tutte le occasioni Marchio   Wakeup Cosmetics Milano Copertura   Totale Vantaggi del prodotto   Corregge le imperfezioni Tonalità della pelle   Tutte le tonalità di pelle Caratteristica speciale   Idratante Dimensioni articolo: LxPxA   45 x 45 x 20 mm,"13,99","13,99","11,89€",N/A,N/A,In stock,https://www.amazon.it/sspa/click?ie=UTF8&spc=MTo3NjE2MTAzMjA3MDE0NzA0OjE3MDE4MzA5MDI6c3BfbXRmOjIwMDY5NDIwMTk1OTAxOjowOjo&url=%2FWakeup-Cosmetics-Milano-693048-Fondotinta%2Fdp%2FB08MXHVSJQ%2Fref%3Dsr_1_81_sspa%3Fkeywords%3Dcosmetics%26qid%3D1701830902%26sr%3D8-81-spons%26sp_csd%3Dd2lkZ2V0TmFtZT1zcF9tdGY%26psc%3D1,Visita lo Store di Wakeup Cosmetics Milano
"Aquaria Thermal Cosmetics Siero Idratante Profonda, 30 ml",N/A,Italy,"Fluido fresco, dotato si un elevato potere idratante dalla consistenza leggera e dal rapido assorbimento Formulato con il 100% di Acqua Termale di Terme di Sirmione, Acido Ialuronico e gel di Alghe Rosse Texture fresca; fragranza delicata dalle dolci note fiorite, senza allergeni Ideale anche per l'uomo come idratante dopo la rasatura; flacone Airless (SENZA CANNUCCIA INTERNA PER EROGAZIONE) Dermatologicamente testato; pH fisiologico; formula con estratti vegetali senza parabeni e petrolati","Tipo di pelle   matura Vantaggi del prodotto   Idratante Fragranza   Fresco Marchio   Terme di Sirmione Forma articolo   Gel Caratteristica del materiale   Cannuccia,Dermatologicamente Testato Ingredienti attivi   acido ialuronico,glicerina Peso articolo   78 Grammi Usi consigliati per il prodotto   Viso Volume articolo   30 Millilitri","19,23","19,23","17,31€",N/A,N/A,In stock,https://www.amazon.it/sspa/click?ie=UTF8&spc=MTo3NjE2MTAzMjA3MDE0NzA0OjE3MDE4MzA5MDI6c3BfbXRmOjIwMDE4MzIyODYzMzAzOjowOjo&url=%2FAquaria-Thermal-Cosmetics-Idratante-Profonda%2Fdp%2FB01BKDWPTO%2Fref%3Dsr_1_82_sspa%3Fkeywords%3Dcosmetics%26qid%3D1701830902%26sr%3D8-82-spons%26sp_csd%3Dd2lkZ2V0TmFtZT1zcF9tdGY%26psc%3D1,Marca: Terme di Sirmione
"Mediterranea - Cofanetto Lavanda - Idea Regalo - Bagnodoccia, Detergente mani, Crema mani e Acqua profumata – con estratti biologici di lavanda",N/A,Italy,"Un cofanetto regalo contenente prodotti della linea lavanda per la detersione e l' idratazione: bagnodoccia 250ml, detergente mani 300ml, crema mani 75 ml ed acqua profumata 100ml Prodotti contenenti estratti biologici di lavanda, passiflora e viola, conosciuti per le loro azioni dermopurificanti, emollienti, idratanti e vitaminizzanti Lasciano la pelle morbida ed idratata e la gradevole fragranza naturale di questi prodotti dona un profondo relax al corpo e alla mente. L’acqua profumata può essere vaporizzata sia sul corpo che sui tessuti, per essere avvolti nella sua delicata fragranza Formule composte dal 97% di ingredienti di origine naturale. SENZA SLES – SENZA PEG – SENZA OLI MINERALI – SENZA SILICONI - SENZA PARABENI Questi quattro prodotti della linea Lavanda sono confezionati in una elegante scatola regalo",Forma articolo   Crema Tipo di pelle   Tutti i tipi di pelle Marchio   MEDITERRANEA COSMETICS Fragranza   Lavanda Caratteristica del materiale   Naturale Colore   LAVANDA,"24,90","24,90","21,17€",N/A,N/A,In stock,https://www.amazon.it/sspa/click?ie=UTF8&spc=MTo3NjE2MTAzMjA3MDE0NzA0OjE3MDE4MzA5MDI6c3BfbXRmOjMwMDEwMTU0MDY0MDIzMjo6MDo6&url=%2FMediterranea-Cofanetto-Bagnodoccia-Detergente-profumata%2Fdp%2FB0BH94S98S%2Fref%3Dsr_1_83_sspa%3Fkeywords%3Dcosmetics%26qid%3D1701830902%26sr%3D8-83-spons%26sp_csd%3Dd2lkZ2V0TmFtZT1zcF9tdGY%26psc%3D1,Visita lo Store di MEDITERRANEA COSMETICS
"RuiDaXiang Albergo della città Kit di costruzione di architettura,3 livelli Hotel modello di blocchi da costruzione giocattolo con luci LDE,per gli adolescenti,adulti (1464 pezzi)",N/A,Italy,"Albergo di città Dimensioni del modello di architettura: 10,3"" (26cm) di lunghezza, 6,9"" (18cm) di larghezza, 11,5"" (29cm) di altezza La decorazione interna è più ricca di quella comune dell'edificio, la porta dell'hotel può essere aperta, include il bancone del bar, la zona pranzo, il pianoforte, le scale, il balcone, la stanza, il balcone e la decorazione delle pareti, che danno vita all'edificio. 3 Livelli Città Albergo Architettura modello costruire è creato blocchi di costruzione con 1512 pezzi,creativo design esclusivo di illuminazione, presentando effetti di luce sorprendenti e una vibrazione calda Forniamo un manuale cartaceo dettagliato e sacchetti di mattoni numerati passo dopo passo. Soluzioni di design modulari L'assemblaggio del kit di illuminazione e dei mattoni da costruzione viene effettuato simultaneamente per evitare di smontare il set di edifici per poi installare le luci. Albergo della città L'architettura è un'attività meravigliosa da svolgere insieme alla famiglia o agli amici, la collezione di adulti o ragazzi è un ottimo pezzo da esposizione per la casa o l'ufficio.","Marchio   RuiDaXiang Età minima del fabbricante (MESI)   144.00 Materiale   ABS Obiettivo didattico   Pensiero creativo Numero di pezzi   1464 Tema   Architettura Caratteristica speciale   易于存储 Anno modello   2023 Dimensioni articolo: LxPxA   26 x 18 x 29 cm Peso articolo   2,6 Libbre","54,99",N/A,N/A,N/A,N/A,In stock,https://www.amazon.it/sspa/click?ie=UTF8&spc=MTo3NjE2MTAzMjA3MDE0NzA0OjE3MDE4MzA5MDI6c3BfbXRmOjMwMDA4NDM2NTUwNjUzMjo6MDo6&url=%2FRuiDaXiang-costruzione-architettura-giocattolo-adolescenti%2Fdp%2FB0CGV2LHQ5%2Fref%3Dsr_1_84_sspa%3Fkeywords%3Dcosmetics%26qid%3D1701830902%26sr%3D8-84-spons%26sp_csd%3Dd2lkZ2V0TmFtZT1zcF9tdGY%26psc%3D1,Marca: RuiDaXiang
"GYADA COSMETICS, Maschera Capelli in Tessuto Nutriente e Ristrutturante, con Cuffia Termica, per Capelli Secchi e Sfibrati, con Olio di Semi di Lino e Malva, 60 ml",B082N1JSM5,Italy,"MASCHERA CAPELLI: Maschera capelli nutriente e ristrutturante. La cuffia sviluppa calore durante l’applicazione, favorendo l’assorbimento degli attivi. La cuffia è lavabile e riutilizzabile PROPRIETA': Maschera capelli ad azione nutriente e ristrutturante con cuffia termica formulata per il trattamento dei capelli secchi e sfibrati, con Burro di Murumuru e Amminoacidi INGREDIENTI: A base di Burro di Murumuru, Arginina, Glutammina, Olio di Semi di Lino ed estratti vegetali di Guaranà e Malva MODO D'USO: Prima o dopo lo shampoo, su capelli tamponati, applicare la cuffia con la linguetta verso la fronte. Rimuovere l’adesivo e chiudere bene. Massaggiare, far agire per 15 minuti, risciacquare GYADA COSMETICS: Cosmetici di alta qualità, creati attraverso l’utilizzo di formulazioni esclusivamente naturali, a base di estratti vegetali e biologici","Marchio   GYADA COSMETICS Forma articolo   Gel Tipo di capelli   Secchi, Danneggiati Vantaggi del prodotto   Nutriente Fascia d'età (descrizione)   Adulti","6,90","6,90","6,21€",N/A,N/A,In stock,https://www.amazon.it/Gyada-Cosmetics-Maschera-Capelli-Tessuto/dp/B082N1JSM5/ref=sr_1_85?keywords=cosmetics&qid=1701830902&sr=8-85,Visita lo Store di GYADA COSMETICS
"GYADA COSMETICS, Gel Detergente Micellare Antiage, per la Pulizia del Viso, Indicato per Pelli Secche e Mature, Azione Struccante per Makeup non Waterproof, con Aloe Vera, 200 ml, 1, 1",B07VWS7H4K,Italy,"GEL DETERGENTE ANTIAGE: Ha un basso potere schiumogeno: deterge efficacemente facendo poca schiuma. Dopo l’uso, non sentirai più la sensazione di pelle che tira. Rimuove le ultime tracce di make-up PROPRIETÀ: Gel detergente micellare indicato per la detersione quotidiana del viso di pelli secche e mature. Può essere usato anche come struccante nel caso di make-up leggeri e non-waterproof INGREDIENTI: Contiene Aloe Vera, Lavanda, Amamelide, Camellia sinensis, Fico d’India MODO D'USO: Distribuisci una piccola quantità di prodotto su tutto il viso e risciacqua GYADA COSMETICS: Cosmetici di alta qualità, creati attraverso l’utilizzo di formulazioni esclusivamente naturali, a base di estratti vegetali e biologici","Forma articolo   Gel Tipo di pelle   mature Marchio   GYADA COSMETICS Fragranza   Lavanda, Aloe vera Caratteristica del materiale   Vegano Numero di articoli   1 Conteggio unità   200.0 millilitro Caratteristica speciale   Alcohol-Free Quantità di articoli nella confezione   1 Da utilizzare per   Faccia","12,99","12,99","11,69€",N/A,N/A,In stock,https://www.amazon.it/GYADA-COSMETICS-Detergente-Struccante-Waterproof/dp/B07VWS7H4K/ref=sr_1_86?keywords=cosmetics&qid=1701830902&sr=8-86,Visita lo Store di GYADA COSMETICS
"GYADA COSMETICS, Siero Capelli Rinforzante con Spirulina, Senza Risciacquo, Ristrutturante, Lucidante, per Capelli Morbidi ed Elastici, Contrasta le Doppie Punte, con Avena e Ginseng, 125 ml",B00W0VJG5M,Italy,"SIERO CAPELLI: Balsamo senza risciacquo, ristrutturante e lucidante. Lascia i capelli morbidi ed elastici. Contrasta la comparsa di doppie punte. Disciplina e districa lunghezze stressate e rovinate PROPRIETÀ: Mantiene la piega per più giorni. Indicato per tutti i tipi di capelli: lisci, mossi, ricci. Restituisce lucentezza e idratazione alle punte. Prodotto approvato dal Curly Girl Method INGREDIENTI: Contiene Spirulina, Avena, Ginseng, Equiseto, Arginina, Valina, Niacinamide, Proteine Idrolizzate da Grano e Soia MODO D'USO: Applicare su capelli umidi e tamponati, risciacquare. Procedere con l’asciugatura. Si consiglia l’uso in combinazione con gli altri prodotti della stessa linea Gyada Cosmetics GYADA COSMETICS: Cosmetici di alta qualità, creati attraverso l’utilizzo di formulazioni esclusivamente naturali, a base di estratti vegetali e biologici","Marchio   MY SPIRU LINA COMPANY Forma articolo   Siero Tipo di capelli   Normal Vantaggi del prodotto   Elastici,Idratazione Usi consigliati per il prodotto   Capelli","15,90","15,90","2,00€",N/A,N/A,In stock,https://www.amazon.it/COSMETICS-Rinforzante-Spirulina-Risciacquo-Ristrutturante/dp/B00W0VJG5M/ref=sr_1_87?keywords=cosmetics&qid=1701830902&sr=8-87,Visita lo Store di MY SPIRU LINA COMPANY
"Luvia Cosmetics, Prime Vegan Pro – Candy, 7 Pennelli Da Trucco Con Contenitore Per Pennelli, Spugna E Tappetino Per La Pulizia Dei Pennelli Da Trucco, In Madreperla E Rosa Perla, Colore: Rosa",B08G53Z51Q,Italy,"🤍SET DI PENNELLI PER IL MAKE-UP PROFESSIONALE: Il set di pennelli da 7 pezzi in rosa contiene tutti i pennelli essenziali per il trucco. L'accessorio per eccellenza per il make-up, sia per il trucco da sposa che per le feste o per il look di tutti i giorni. 🤍CONSIGLIATO DAGLI ARTISTI DEL MAKE-UP: I pennelli cosmetici vegani di Luvia sono precisi e scorrevoli: il set di pennelli professionali è consigliato per un'applicazione uniforme di fondotinta, cipria, fard o ombretto. Con i pennelli giusti per ogni prodotto, puoi ottenere un look perfetto in pochi passi. 🤍SETOLE VEGANE “NURAI”: Il segreto dei pennelli da trucco Luvia sono le setole sintetiche di alta qualità. Le raffinate setole raccolgono perfettamente fondotinta, cipria, ecc. e distribuiscono il prodotto in modo impeccabile e uniforme, - per un risultato di make-up splendido. Luvia offre i pennelli perfetti per sfumare i cosmetici. 🤍MORBIDI E DELICATI PER LA PELLE: I pennelli vegani di Luvia sono ultra delicati e quindi perfetti per le pelli sensibili e per chi soffre di allergie. Le setole sintetiche dei pennelli hanno una superficie fibrosa raffinata, sono delicati sulla pelle e prevengono gli arrossamenti. 🤍FACILI DA PULIRE E A LUNGA DURATA: Niente più macchie della pelle: la speciale setola del pennello Luvia è facile da pulire e garantisce la massima igiene. La superficie liscia delle fibre sintetiche impedisce a residui, sporco e pelle morta di penetrare nei pennelli. Tutti i pennelli per il trucco sono ben legati, senza spazi vuoti. Le setole non diventano fragili e rimangono sempre morbide ed elastiche. Nessuna rottura delle setole, nessuna perdita! 🤍REGALO PER LE AMANTI DEL MAKE-UP: Premiate le vostre persone preferite con questo set di make-up di alta qualità! Confezionato con cura, il kit make-up all-in-one è pronto per essere regalato! Questo rende i pennelli professionali il regalo perfetto per le donne e per gli uomini esperti di cosmetica. Sorprendete i vostri cari con un set di pennelli per il trucco lussuoso ma conveniente. 🤍OMAGGI ESCLUSIVI: Il lussuoso tubo per pennelli è il contenitore ideale per pennelli e strumenti per il trucco. Il contenitore è diviso in due parti e può essere comodamente chiuso e portato con sé durante i viaggi. Il design elegante rende il porta pennello un elemento glamour sul tavolo da trucco o in viaggio. Con il pratico tappetino per la pulizia dei pennelli potrete pulire tutti i vostri pennelli da trucco in modo rapido e igienico!","Materiale delle setole   Nurai Marchio   Luvia Cosmetics Usi consigliati per il prodotto   Fard,Fondotinta Colore   rosa Materiale   (Legno","35,19",N/A,N/A,N/A,N/A,In stock,https://www.amazon.it/Luvia-Prime-Vegan-Pro-contenitore/dp/B08G53Z51Q/ref=sr_1_88?keywords=cosmetics&qid=1701830902&sr=8-88,Marca: Luvia Cosmetics
"GYADA COSMETICS, Maschera Viso Idratante e Rigenerante, Migliora l’Aspetto di Pelli Secche, Disidratate e Spente, Formula a Base di Aloe Vera e Acido Ialuronico ad Alto Peso Molecolare, 75 ml",B08ZK5KJLX,Italy,"MASCHERA VISO: Maschera viso a base di ingredienti dalle proprietà idratanti, restitutive e riparatrici, ideali per migliorare l’aspetto di pelli secche, disidratate e spente PROPRIETÀ: Dona alla pelle una sensazione di comfort grazie alla texture morbida e cremosa. Applicandola con costanza, la pelle apparirà più morbida e idratata INGREDIENTI: Contiene Aloe, Kiwi e Cetriolo, ricchi in Vitamine e Sali minerali, Acido Ialuronico ad alto peso molecolare, Allantoina e Malva dall’azione lenitiva ed Olio di Cocco e Jojoba MODO D'USO: Applicala su pelle pulita e asciutta con Mask Brush, il Pennello per Maschera Viso. Tieni in posa la maschera per 15 minuti e risciacqua GYADA COSMETICS: Cosmetici di alta qualità, creati attraverso l’utilizzo di formulazioni esclusivamente naturali, a base di estratti vegetali e biologici","Marchio   GYADA COSMETICS Forma articolo   Crema Vantaggi del prodotto   Idratante Fragranza   Aloe vera Tipo di pelle   Tutti i tipi di pelle Caratteristica speciale   Idratante Componenti inclusi   Acido Ialuronico, Aloe Vera, Cetriolo Conteggio unità   75.0 millilitro Numero di articoli   1 Usi consigliati per il prodotto   Viso","10,92","10,92","9,83€",N/A,N/A,In stock,https://www.amazon.it/GYADA-COSMETICS-Maschera-Idratante-Rigenerante/dp/B08ZK5KJLX/ref=sr_1_89?keywords=cosmetics&qid=1701830902&sr=8-89,Visita lo Store di GYADA COSMETICS
"GYADA COSMETICS, Impacco Modellante Ricci 200 ml",B09J19FGV9,Italy,"MASCHERA RISTRUTTURANTE: Impacco per capelli ricci e crespi a base di ingredienti ad azione ristrutturante, ideali per restituire morbidezza ed elasticità ai capelli secchi, crespi e sfibrati PROPRIETÀ: Rende i capelli fragili e sottili forti, elastici e resistenti agli agenti chimico fisici esterni. Anticrespo. Profumazione di vaniglia e limone. Prodotto approvato dal Curly Girl Method INGREDIENTI: Contiene un Complesso di Proteine Vegetali idrolizzate, rinforzante, Linfa di Vite, elasticizzante, Acqua di Riso Fermentata, anticrespo, Olio di Mandorla e Burro di Karité MODO D'USO: Applica l'impacco su tutte le lunghezze. Lascia in posa per almeno 5 minuti. Risciacqua con cura GYADA COSMETICS: Cosmetici di alta qualità, creati attraverso l’utilizzo di formulazioni esclusivamente naturali, a base di estratti vegetali e biologici",Marchio   GYADA COSMETICS Forma articolo   Gel Tipo di capelli   Ricci Vantaggi del prodotto   Ristrutturante Fascia d'età (descrizione)   Adulti,"17,90","17,90","2,00€",N/A,N/A,In stock,https://www.amazon.it/GYADA-COSMETICS-Modellante-Ristrutturante-Rinforzante/dp/B09J19FGV9/ref=sr_1_90?keywords=cosmetics&qid=1701830902&sr=8-90,Visita lo Store di GYADA COSMETICS
"GYADA COSMETICS, Fluido Gel ad Azione Modellante per Capelli Ricci Effetto Morbido, Disciplinante e Anticrespo, a Base di Lavanda, Aloe Vera e Olio di Lino, 125 ml",B07PN6DJVG,Italy,"GEL PER RICCI MORBIDI: Gel fluido senza risciacquo per lo styling dei capelli ricci e mossi, dall’azione modellante e disciplinante. Effetto Morbido PROPRIETÀ: Modella i capelli ricci e mossi senza appiccicare. Lascia i ricci morbidi. Non appesantisce/unge i capelli e ha effetto anticrespo. Prodotto approvato dal Curly Girl Method INGREDIENTI: Formula a base di Lavanda, Aloe Vera, Acacia, Arnica, Bardana, Calendula, Olio di Lino, Olio di Cocco, Olio di Argan e Olio di Jojoba MODO D'USO: Distribuisci uno o due pump di Fluido Gel e modella i ricci con la tecnica dello scrunching per almeno un paio di minuti, asciuga poi con diffusore. Applicabile anche sui capelli asciutti GYADA COSMETICS: Cosmetici di alta qualità, creati attraverso l’utilizzo di formulazioni esclusivamente naturali, a base di estratti vegetali e biologici","Vantaggi del prodotto   Anti-crespo Tipo di capelli   Ricci Fragranza   Aloe Vera,Lavanda,Vera Volume liquido   125 Millilitri Forma articolo   Gel Marchio   GYADA COSMETICS Numero di articoli   1 Conteggio unità   125.0 millilitro Volume articolo   125 Millilitri","14,90","14,90","2,00€",N/A,N/A,In stock,https://www.amazon.it/Gyada-Cosmetics-Fluido-Modellante-Ricci/dp/B07PN6DJVG/ref=sr_1_91?keywords=cosmetics&qid=1701830902&sr=8-91,Visita lo Store di GYADA COSMETICS
"Neve Cosmetics fondotinta liquido Cream-To-Serum, fondotinta multisensoriale elastico e stratificabile a piacere | ""Tan Neutral""",B0CKZ1SSKT,Italy,"Tonalità scura dal sottotono neutro. Fondotinta in crema/siero effetto pelle sana e luminosa. Ideale per pelli bisognose di cura e morbidezza. Vegano, vegetariano, arricchito con estratti di anguria, lenticchia e mela. Agitare bene prima dell'uso!","Forma articolo   Liquido Colore   Beige Tipo di pelle   Sensibile, Normale, Mista, Secca Marchio   Neve Cosmetics Copertura   Media Vantaggi del prodotto   Correzione del colore, Rivitalizzante, Idratante Tonalità della pelle   Medio scura Fascia d'età (descrizione)   Adulti Caratteristica speciale   Leggero Peso articolo   55 Grammi","15,90",N/A,N/A,N/A,N/A,In stock,https://www.amazon.it/Neve-Cosmetics-fondotinta-multisensoriale-stratificabile/dp/B0CKZ1SSKT/ref=sr_1_92?keywords=cosmetics&qid=1701830902&sr=8-92,Marca: Neve Cosmetics
Cosmetic playlover (Vol. 3),8869138720,Italy,,,"7,50",N/A,N/A,N/A,N/A,In stock,https://www.amazon.it/Cosmetic-playlover-Vol-Sachi-Narashima/dp/8869138720/ref=sr_1_93?keywords=cosmetics&qid=1701830902&sr=8-93,N/A
