Name,ASIN,Region,Description,Breakdown,Price,Deal Price,You saved,Rating,Rating count,Availability,Hyperlink,Store
"Freshly Cosmetics - Olio Corpo Nutriente 100% Naturale Golden Radiance Body Oil, 100ml",N/A,Italy,Nutre la pelle in profondità. Aumenta l’elasticità stimolando la sintesi del collagene Previene e migliora l’aspetto di cicatrici e smagliature. Protegge la pelle dal fotoinvecchiamento Texture vellutata che non unge e si assorbe in fretta 100% d’ingredienti naturali Non contiene oli sintetici né siliconi,"Marchio   Freshly Cosmetics Fragranza   Bergamotto Forma articolo   Olio Ingredienti attivi     Astaxantina, olio di marula, olio di semi di chia, olio di rosa mosqueta, olio di jojoba bio, olio di babassu bio, olio di macadamia, olio di nocciola bio, olio di avocado, olio di papavero bio...   Mostra altro Conteggio unità   100.0 millilitro Numero di articoli   1 Da utilizzare per   Corpo Tipo di pelle   Tutti i tipi di pelle Volume articolo   100 Millilitri Fascia d'età (descrizione)   Adultos","26,95","26,95","25,60€",N/A,N/A,In stock,https://www.amazon.it/sspa/click?ie=UTF8&spc=MToyMDAyMjI4ODUzMzI3MDQ6MTcwMTgzMDkwMjpzcF9hdGY6MjAxMTY5MjYxMzI1OTg6OjA6Og&url=%2FFreshly-Cosmetics-Nutriente-Naturale-Radiance%2Fdp%2FB0B8SSHSVJ%2Fref%3Dsr_1_1_sspa%3Fkeywords%3Dcosmetics%26qid%3D1701830902%26sr%3D8-1-spons%26sp_csd%3Dd2lkZ2V0TmFtZT1zcF9hdGY%26psc%3D1,Marca: Freshly Cosmetics
"It Cosmetics Your Skin But Better CC - crema con SPF 50+, abbronzatura media",N/A,Italy,"Colore: Medium – Tan # 1 best-seller, premiato formula. Griglie color-correcting crema, anti-invecchiamento cura della pelle e SPF 50 + UVA/UVB ad ampio spettro Physical crema solare per la pelle, ma migliore Anti-aging peptidi, collagene idrolizzato, vitamine E antiossidanti",Marchio   IT Cosmetics Fragranza   Shea Butter Forma articolo   Crema Ingredienti attivi   peptidi Conteggio unità   12 millilitro Numero di articoli   1 Da utilizzare per   Faccia Tipo di pelle   Tutti i tipi di pelle Ingredienti speciali   Hyaluronic acid Volume articolo   32 Millilitri,"59,00",N/A,N/A,N/A,N/A,In stock,https://www.amazon.it/sspa/click?ie=UTF8&spc=MToyMDAyMjI4ODUzMzI3MDQ6MTcwMTgzMDkwMjpzcF9hdGY6MjAxMTg4OTA3Njk4OTg6OjA6Og&url=%2FCosmetics-your-Better-Cream-Medium%2Fdp%2FB071CMS2BD%2Fref%3Dsr_1_2_sspa%3Fkeywords%3Dcosmetics%26qid%3D1701830902%26sr%3D8-2-spons%26sp_csd%3Dd2lkZ2V0TmFtZT1zcF9hdGY%26psc%3D1%26smid%3DA2WS6U4W1X5MB6,Marca: IT Cosmetics
"Camaleon Cosmetics - Magic Serum - Effetto tensore immediato - Elimina borse e occhiaie - Incolore - Vegano - 2 Unità, 4ml",N/A,Italy,Elimina i segni visibili dell'invecchiamento della pelle offrendo un aspetto più giovane in tempo record. Ingredienti: Argireliene e minerali attivi,Tipo di pelle   Tutti i tipi di pelle Marchio   CAMALEON COSMETICS Volume articolo   1 Millilitri Numero di articoli   1 Conteggio unità   1 unità,"12,90","12,90","12,26€",N/A,N/A,In stock,https://www.amazon.it/sspa/click?ie=UTF8&spc=MToyMDAyMjI4ODUzMzI3MDQ6MTcwMTgzMDkwMjpzcF9hdGY6MjAxNjEyMzg5Mjk5OTg6OjA6Og&url=%2FCamaleon-Cosmetics-immediato-occhiaie-Incolore%2Fdp%2FB01M9B752W%2Fref%3Dsr_1_3_sspa%3Fkeywords%3Dcosmetics%26qid%3D1701830902%26sr%3D8-3-spons%26sp_csd%3Dd2lkZ2V0TmFtZT1zcF9hdGY%26psc%3D1,Visita lo Store di CAMALEON COSMETICS
"Freshly Cosmetics - Olio Corpo Nutriente 100% Naturale Golden Radiance Body Oil, 200 ml",N/A,Italy,Nutre la pelle in profondità. Aumenta l’elasticità stimolando la sintesi del collagene Previene e migliora l’aspetto di cicatrici e smagliature. Protegge la pelle dal fotoinvecchiamento Texture vellutata che non unge e si assorbe in fretta 100% d’ingredienti naturali Non contiene oli sintetici né siliconi,"Marchio   Freshly Cosmetics Fragranza   Bergamotto Forma articolo   Olio Ingredienti attivi     Astaxantina, olio di marula, olio di semi di chia, olio di rosa mosqueta, olio di jojoba bio, olio di babassu bio, olio di macadamia, olio di nocciola bio, olio di avocado, olio di papavero bio...   Mostra altro Conteggio unità   200.0 millilitro Numero di articoli   1 Da utilizzare per   Corpo Tipo di pelle   Tutti i tipi di pelle Volume articolo   200 Millilitri Fascia d'età (descrizione)   Adultos","47,95",N/A,N/A,N/A,N/A,In stock,https://www.amazon.it/sspa/click?ie=UTF8&spc=MToyMDAyMjI4ODUzMzI3MDQ6MTcwMTgzMDkwMjpzcF9hdGY6MjAxMTY5MjYxMzI2OTg6OjA6Og&url=%2FFreshly-Cosmetics-Nutriente-Naturale-Radiance%2Fdp%2FB0B8ST6PVM%2Fref%3Dsr_1_4_sspa%3Fkeywords%3Dcosmetics%26qid%3D1701830902%26sr%3D8-4-spons%26sp_csd%3Dd2lkZ2V0TmFtZT1zcF9hdGY%26psc%3D1,Marca: Freshly Cosmetics
"ZMILE Cosmetics Tavolozza Trucco 'All You Need To Go', Cosmetici Vegan",B0B6GCJWZX,Italy,"Contenuto: 24 ombretti, 8 x Blush, 6 x Crema lucida labbra, 1 x Polvere per il viso, 1 x mascara, 1 x set di pennelli, applicatori da 4 pezzi, 1 specchio integrato Cosmetici vegan","Colore   Nero Marchio   ZMILE Cosmetics Forma articolo   Cream, Powder Vantaggi del prodotto   Variety Tonalità della pelle   Tutte le tonalità di pelle Tipo di pelle   Normale Dimensioni articolo: LxPxA   9,2 x 13,2 x 3,5 cm Peso articolo   222 Grammi Conteggio unità   1 unità","10,95",N/A,N/A,N/A,N/A,In stock,https://www.amazon.it/ZMILE-Cosmetics-Tavolozza-Trucco-Cosmetici/dp/B0B6GCJWZX/ref=sr_1_5?keywords=cosmetics&qid=1701830902&sr=8-5,Marca: ZMILE Cosmetics
"ZMILE Cosmetics Tavolozza Trucco 'Classic', Cosmetici Vegan",B0B6GDBB53,Italy,"Contenuto: 24 x ombretti, 4 x blush, 1 x highlighter, 5 x lip gloss cream, vasetto, 4 x lucidalabbra crema, 2 x cipria, 1 x kohl, 1 x pettine, 1 x 8 pezzi set pennello / applicatore, 1 specchio integrato Cassetta trucco, trucco di qualità con 51 pezzi Cosmetici vegan","Colore   Nero Marchio   ZMILE Cosmetics Forma articolo   Cream Tonalità della pelle   Tutte le tonalità di pelle Tipo di pelle   Normale Dimensioni articolo: LxPxA   11,5 x 19,5 x 4,4 cm Peso articolo   588 Grammi Informazioni pacco   Scatola Conteggio unità   1 unità","18,21",N/A,N/A,N/A,N/A,In stock,https://www.amazon.it/ZMILE-Cosmetics-Tavolozza-Classic-Cosmetici/dp/B0B6GDBB53/ref=sr_1_6?keywords=cosmetics&qid=1701830902&sr=8-6,Marca: ZMILE Cosmetics
"ZMILE Cosmetics Tavolozza Trucco 'Diamonds', Cosmetici Vegan",B0B6GFJNNL,Italy,"Contiene: 16 ombretti, 8 x Crema lucida labbra, 8 x Crema glitterata per il corpo, 3 x Fard, 2 x Polvere per il viso, 1 x soffio di polvere, 1 x set di pennelli/applicatori da 3 pezzi, 1 specchio integrato Compartimenti laterali estensibili e cassetto integrato Set Make-up in confezione rigida stabile Cosmetici vegan","Colore   Multicolore Marchio   ZMILE Cosmetics Forma articolo   Cream, Powder Tonalità della pelle   Tutte le tonalità di pelle Tipo di pelle   Normale Dimensioni articolo: LxPxA   9,2 x 12,1 x 2,8 cm Conteggio unità   1 unità","9,45",N/A,N/A,N/A,N/A,In stock,https://www.amazon.it/ZMILE-Cosmetics-Tavolozza-Diamonds-Cosmetici/dp/B0B6GFJNNL/ref=sr_1_7?keywords=cosmetics&qid=1701830902&sr=8-7,Marca: ZMILE Cosmetics
Eveline Cosmetics SOS Lash Booster Siero Per Ciglia 5in1 | 10 ml | Siero Per La Crescita Delle Ciglia | Booster Per Ciglia A Doppio Volume | Balsamo Rinforzante E Addensante | Olio Di Argan,B01KQWAX58,Italy,"STIMOLATORE DELLA CRESCITA DELLE CIGLIA - Il siero combina le proprietà di un siero ricostituente e di uno stimolatore della crescita. Con l'uso regolare le ciglia diventano folte, lucenti e con il tempo raddoppiano il loro volume. FORMULA INNOVATIVA CON OLIO DI ARGAN - L'innovativa formula arricchita in principi attivi avanzati lavora in sinergia con l'olio di Argan e mostra spiccate proprietà nutrienti e rigeneranti. Ispessisce perfettamente le ciglia. BASE PERFETTA PER MASCARA - Il siero è una base perfetta sotto il trucco. Non provoca sbavature o sgretolamenti del mascara. Aiuta a ottenere l'effetto di spettacolari ciglia lunghe e ispessite. SPAZZOLA FLESSIBILE PROFESSIONALE - La spazzola flessibile appositamente progettata separa con precisione le ciglia e dona immediatamente agli occhi un aspetto ipnotizzante. GARANZIA DI RIMBORSO DI 30 GIORNI - Crediamo di avere il prodotto di altissima qualità sul mercato. Pertanto, il nostro prodotto è coperto da una garanzia di rimborso di 30 giorni che dimostra che siamo certi che ne sarai soddisfatto al 100%.",Colore   nero Marchio   Eveline Cosmetics Forma articolo   Gel Vantaggi del prodotto   Nutrienti Tonalità della pelle   Tutte le tonalità di pelle Tipo di pelle   Tutti i tipi di pelle Dimensioni articolo: LxPxA   8 x 8 x 50 mm Peso articolo   10 Grammi Conteggio unità   10.0 millilitro,"7,27","7,27","0,41€",N/A,N/A,In stock,https://www.amazon.it/Eveline-Cosmetics-Booster-maggiore-gepflegte/dp/B01KQWAX58/ref=sr_1_8?keywords=cosmetics&qid=1701830902&sr=8-8,Marca: Eveline Cosmetics
"essence cosmetics Ess. Lash Princess Sculpted Volume Mascara De Pestañas, nero",B06WW9SJ5M,Italy,Ess. Lash Princess Sculpted Volume Mascara De Pestañas,"Colore   Nero Vantaggi del prodotto   Volumizzante Caratteristica speciale   volumizzante Marchio   Essence Cosmetics Specialità   Volume intenso Numero di articoli   1 Conteggio unità   1 unità Volume articolo   74,88 Millilitri Livello di resistenza all'acqua   Impermeabile Copertura   Volume","3,60","3,60","0,40€",N/A,N/A,In stock,https://www.amazon.it/essence-cosmetics-Princess-Sculpted-Pesta%C3%B1as/dp/B06WW9SJ5M/ref=sr_1_9?keywords=cosmetics&qid=1701830902&sr=8-9,Marca: essence
"ZMILE Cosmetics Valigia per il Trucco 'Beauty Case', Nero, Cosmetici Vegan",B0B6GGHWMG,Italy,"Contenuto: 45 ombretti, 12 lucidalabbra, 6 fard, 2 highlighter, 2 rossetti, 2 lucidalabbra, 2 lip liner, 6 x applicatore doppio, 3 x pennello per labbra, 1 x pennello piatto per cipria Beauty case completo in pelle nera, pieghevole come una scala; la composizione di colori alla moda per una casa e un viaggio ottima attrezzati Specchio integrato Ampio beauty case per il trucco in pelle nera Cosmetici vegan","Colore   Nero Marchio   ZMILE Cosmetics Forma articolo   Powder Tonalità della pelle   Tutte le tonalità di pelle Tipo di pelle   Normale Dimensioni articolo: LxPxA   14,4 x 22,8 x 16,2 cm Informazioni pacco   Scatola Conteggio unità   1 unità","26,05",N/A,N/A,N/A,N/A,In stock,https://www.amazon.it/ZMILE-Cosmetics-Valigia-Trucco-Cosmetici/dp/B0B6GGHWMG/ref=sr_1_10?keywords=cosmetics&qid=1701830902&sr=8-10,Marca: ZMILE Cosmetics
"Freshly Cosmetics - Olio Corpo Nutriente 100% Naturale Golden Radiance Body Oil, 100ml",B0B8SSHSVJ,Italy,Nutre la pelle in profondità. Aumenta l’elasticità stimolando la sintesi del collagene Previene e migliora l’aspetto di cicatrici e smagliature. Protegge la pelle dal fotoinvecchiamento Texture vellutata che non unge e si assorbe in fretta 100% d’ingredienti naturali Non contiene oli sintetici né siliconi,"Marchio   Freshly Cosmetics Fragranza   Bergamotto Forma articolo   Olio Ingredienti attivi     Astaxantina, olio di marula, olio di semi di chia, olio di rosa mosqueta, olio di jojoba bio, olio di babassu bio, olio di macadamia, olio di nocciola bio, olio di avocado, olio di papavero bio...   Mostra altro Conteggio unità   100.0 millilitro Numero di articoli   1 Da utilizzare per   Corpo Tipo di pelle   Tutti i tipi di pelle Volume articolo   100 Millilitri Fascia d'età (descrizione)   Adultos","26,95","26,95","25,60€",N/A,N/A,In stock,https://www.amazon.it/Freshly-Cosmetics-Nutriente-Naturale-Radiance/dp/B0B8SSHSVJ/ref=sr_1_11?keywords=cosmetics&qid=1701830902&sr=8-11,Marca: Freshly Cosmetics
"Nabla Cupid’s Arrow Longwear Stylo, Arrow #4, 0.8 g",B08LKXHT4K,Italy,"Matita stylo multifunzione di lunga durata Colore pieno in una sola passata Eccellente scorrevolezza e precisione, con temperino integrato Elegante design pouch friendly Cruelty Free & Vegan",Colore   Nero Intenso Marchio   Nabla Forma articolo   Matita Caratteristica speciale   Vegano Numero di articoli   1 Fascia d'età (descrizione)   Adulti Dimensioni articolo: LxPxA   25 x 25 x 91 mm Informazioni pacco   Matita Tipo di pacco   Scatola Caratteristica del materiale   Vegano,"15,90","15,90","1,00€",N/A,N/A,In stock,https://www.amazon.it/Nabla-Matitone-Cupids-Arrow-N4/dp/B08LKXHT4K/ref=sr_1_12?keywords=cosmetics&qid=1701830902&sr=8-12,Marca: Nabla
"Delia Cosmetics – Clean Me - Struccante per viso e occhi - Tutti i tipi di pelle - Pulisce, rimuove il trucco, idrata – Cosmetico veganoi - 40g",B09M7DPWKY,Italy,"CLEAN ME - Lozione struccante per tutti i tipi di pelle COMPONENTI ATTIVI - Contiene ingredienti di origine naturale come olio di mandorle, burro di cacao, burro di mango. NON C'È BISOGNO DI UN BATUFFOLO DI COTONE! Da applicare direttamente con le dita. Cambia da solido a liquido con una texture setosa durante l'applicazione. CURA A PORTATA DI MANO- Efficiente contenitore da 40g, ideale anche per i viaggi. Formula delicata che rimuove efficacemente il trucco e le impurità accumulate durante il giorno. SCOPRI LA BELLA PELLE con i cosmetici TONIC ME, scopri tutti i nostri prodotti per la pulizia e la cura della pelle sul sito",Forma articolo   Crema Tipo di pelle   Tutti i tipi di pelle Marchio   Delia Cosmetics Fragranza   Mango Caratteristica del materiale   Non testato sugli animali Fascia d'età (descrizione)   Adulti Numero di articoli   1 Conteggio unità   40.0 grammo Caratteristica speciale   Ingredienti naturali Ingredienti speciali   Burro di cacao,"8,70","8,70","7,40€",N/A,N/A,In stock,https://www.amazon.it/Delia-Cosmetics-Struccante-mandorle-Cosmetico/dp/B09M7DPWKY/ref=sr_1_13?keywords=cosmetics&qid=1701830902&sr=8-13,Visita lo Store di Delia Cosmetics
"GYADA COSMETICS, 5th Anniversary, Impacco Capelli Rinforzante con Spirulina, Nutriente, Anticaduta, Contrasta le Doppie Punte, Indicato per Capelli Fragili, con Avena e Ginseng, 250 ml, 1",B0BJDKHK41,Italy,"IMPACCO CAPELLI: Rinforza e lucida la fibra capillare. Nutre il fusto, potreggendolo da agenti esterni. Ideale come trattamento per contrastare la caduta dei capelli e la formazione delle doppie punte PROPRIETÀ: Un impacco concentrato vitaminizzante e remineralizzante ideale per restituire vigore alle chiome più fragili, stressate e tendenti al diradamento. Prodotto approvato dal Curly Girl Method INGREDIENTI: Contiene Spirulina, Avena, Ginseng, Equiseto, Arginina, Valina, Niacinamide, Proteine Idrolizzate da Grano e Soia MODO D'USO: Si consiglia di effettuare un impacco pre-shampoo 1-2 volte a settimana e di lasciarlo in posa per almeno 30 minuti. In alternativa, è possibile applicarlo dopo lo shampoo GYADA COSMETICS: Cosmetici di alta qualità, creati attraverso l’utilizzo di formulazioni esclusivamente naturali, a base di estratti vegetali e biologici","Marchio   GYADA COSMETICS Forma articolo   Crema Tipo di capelli   Danneggiato Vantaggi del prodotto   Nutriente,Rinforzante Fascia d'età (descrizione)   Adulti","17,90","17,90","17,01€",N/A,N/A,In stock,https://www.amazon.it/GYADA-COSMETICS-Anniversary-Rinforzante-Anticaduta/dp/B0BJDKHK41/ref=sr_1_14?keywords=cosmetics&qid=1701830902&sr=8-14,Visita lo Store di GYADA COSMETICS
"Grande Cosmetics GrandeLASH-MD Siero per migliorare le ciglia, 2 ml",B00325D0WK,Italy,Aiuta a promuovere la comparsa di ciglia naturalmente più lunghe e dall'aspetto più spesso Adatto per l'uso con estensioni delle ciglia e contatti Oftalmologo testato,"Tipo di pelle   Normale Vantaggi del prodotto     Promotes naturally longer, thicker, healthier looking lashes. For a full list of benefits, see details below.   Mostra altro Marchio   Grande Cosmetics Forma articolo   Serum Caratteristica del materiale   Cruelty Free Peso articolo   36 Grammi Volume articolo   2 Millilitri Numero di articoli   1 Conteggio unità   2.0 millilitro","48,50",N/A,N/A,N/A,N/A,In stock,https://www.amazon.it/GrandeNaturals-GN1002-Grandelash-GrandeLASH-MD-fornitura/dp/B00325D0WK/ref=sr_1_15?keywords=cosmetics&qid=1701830902&sr=8-15,Marca: Grande Cosmetics
Layla Cosmetics IT's PINK Trasformative PH Lip Gloss + SCRUB labbra set regalo,B0CMVWKPW9,Italy,"La sua formula non si limita a colorare, ma nutre e protegge le labbra, grazie alla combinazione di ingredienti di alta qualità La profumazione di vaniglia, delicata e avvolgente, rende l'applicazione un momento piacevole e rilassante La sua texture leggera e non appiccicosa garantisce comfort durante tutto il giorno IT'S PINK non è solo un prodotto di bellezza, ma un alleato quotidiano per labbra sempre perfette","Marchio   LAYLA Colore   Rosa Tipo di pelle   Tutti i tipi di pelle Forma articolo   Gel Vantaggi del prodotto     Adattabilità: Il gloss si adatta al pH delle tue labbra, garantendo una tonalità di rosa unica. Lunga durata: anche quando l’effetto gloss svanisce, il colore rimane. Idratazione profonda: Grazie agli ingredienti come l’olio di jojoba, le tue labbra rimarranno idratate e nutrite.   Mostra altro Tonalità della pelle   Tutte le tonalità di pelle Caratteristica speciale   Lunga durata, Resistente allo sbiadimento Numero di articoli   1","12,43",N/A,N/A,N/A,N/A,In stock,https://www.amazon.it/Layla-Cosmetics-Trasformative-labbra-regalo/dp/B0CMVWKPW9/ref=sr_1_16?keywords=cosmetics&qid=1701830902&sr=8-16,Visita lo Store di Layla
"KORFF Cure Make Up Base Levigante, Primer Make Up con Acido Ialuronico",N/A,Italy,,"Marchio   Korff Vantaggi del prodotto     Corregge i rossori e le discromie cutanee; Uniforma l’incarnato, rendendo meno visibili le imperfezioni; Facilita la stesura del fondotinta, migliorandone la tenuta.   Mostra altro Forma articolo   Crema Tipo di pelle   Tutti i tipi di pelle Volume articolo   30 Millilitri Numero di articoli   1 Conteggio unità   30.0 grammo Peso articolo   100 Grammi","22,30",N/A,N/A,N/A,N/A,In stock,https://www.amazon.it/sspa/click?ie=UTF8&spc=MToyMDAyMjI4ODUzMzI3MDQ6MTcwMTgzMDkwMjpzcF9tdGY6MjAwNDkwMTM4Mzg0MDE6OjA6Og&url=%2FKorff-Anti-Rossore-Ialuronico-Levigata-lincarnato%2Fdp%2FB07TX6WLTF%2Fref%3Dsr_1_17_sspa%3Fkeywords%3Dcosmetics%26qid%3D1701830902%26sr%3D8-17-spons%26sp_csd%3Dd2lkZ2V0TmFtZT1zcF9tdGY%26psc%3D1,N/A
"Creator Palette Ombretti Layla 28 Colori Duochrome, Metal Mirror, Butterspark, Mat Texture Morbida e Cremosa Anallergici e Nichel Testati Studio Cromatico Unico Personalizza il Tuo Makeup",N/A,Italy,"Palette ombretti Layla Cosmetics Creator con 28 colori Duochrome, Metal Mirror, Butterspark e Mat Texture morbida e cremosa per gli ombretti Duochrome e Metal Mirror, arricchiti con sfumature multi-cromatiche e consistenza quasi cremosa Ombretti Butterspark con microglitter e texture quasi materica che si prestano anche come top coat Ombretti Mat con texture morbida in polvere micronizzata antimacchia, perfetti per qualsiasi uso e per definire le sfumature Tutti gli ombretti sono anallergici e nichel testati per garantire una maggiore sicurezza Studio cromatico unico con presenza di toni caldi e freddi, che rende la palette comoda e multiuso per le più svariate esigenze Possibilità di personalizzare il makeup in base al proprio gusto individuale, grazie alla varietà di colori e finish Testati per scrittura, resistenza, sfumabilità e fallout per garantire un risultato ottimale",Colore   Multicolor Marchio   Layla Cosmetics Forma articolo   Polvere Vantaggi del prodotto   Morbida Numero di articoli   1 Conteggio unità   300.0 grammo Copertura   Media Tipo di pelle   Tutti i tipi di pelle Informazioni pacco   Palette Tipo di pacco   Scatola,"24,85","24,85","1,45€",N/A,N/A,In stock,https://www.amazon.it/sspa/click?ie=UTF8&spc=MToyMDAyMjI4ODUzMzI3MDQ6MTcwMTgzMDkwMjpzcF9tdGY6MjAxNTQ4OTk3MTg2OTg6OjA6Og&url=%2FLayla-Duochrome-Butterspark-Anallergici-Personalizza%2Fdp%2FB0C4PJZDTN%2Fref%3Dsr_1_18_sspa%3Fkeywords%3Dcosmetics%26qid%3D1701830902%26sr%3D8-18-spons%26sp_csd%3Dd2lkZ2V0TmFtZT1zcF9tdGY%26psc%3D1,Marca: Layla Cosmetics
TINTARK Palette Ombretti 14 Colori Glitter Shimmer Metallic Occhi Ombretto Altamente Pigmentato Galaxy Eye Make up Blu Trucchi Palettes (Galactic Assemble),N/A,Italy,"Palette di ombretti: 30 colorati arcobaleno include 11 matte setosi, 5 glitter, 10 metallic, 2 glitter stellati, 2 sparkle. Incantevoli colori dell'arcobaleno! Palline luccicanti piene di divertimento! Questo ombretto a 30 colori ha un sacco di speciali palline effetto perlato, puoi combinare i colori come preferisci per rendere il tuo processo di trucco pieno di gioia. Facile da usare: fintanto che hai questa palette di ombretti con uno specchio quando esci, puoi applicare il trucco in qualsiasi momento senza cercare uno specchio aggiuntivo. Lunga durata e impermeabile: la formula impermeabile a lunga durata dell'ombretto mantiene il tuo ombretto perfetto per lungo tempo. Regalati un'esperienza confortevole. Sicuro, pulito e salutare: senza talco, cruelty-free, vegano, senza test sugli animali e senza ingredienti di origine animale, senza olio minerale, tutti i coloranti approvati da USA e EURO e imballaggi ecologici.","Colore   Galactic Assemble Marchio   Tintark Forma articolo   Polvere Caratteristica speciale   Impermeabile,Lunga Durata Vantaggi del prodotto   Setosi Numero di articoli   1 Conteggio unità   36.0 grammo Dimensioni articolo: LxPxA   18 x 17 x 3,7 cm Informazioni pacco   Palette Tipo di pacco   Scatola","25,99","25,99","23,99€",N/A,N/A,In stock,https://www.amazon.it/sspa/click?ie=UTF8&spc=MToyMDAyMjI4ODUzMzI3MDQ6MTcwMTgzMDkwMjpzcF9tdGY6MzAwMDQ2NTAwODQxOTMyOjowOjo&url=%2FOmbretti-Metallic-Altamente-Pigmentato-Space-like%2Fdp%2FB0BPGK16ZB%2Fref%3Dsr_1_19_sspa%3Fkeywords%3Dcosmetics%26qid%3D1701830902%26sr%3D8-19-spons%26sp_csd%3Dd2lkZ2V0TmFtZT1zcF9tdGY%26psc%3D1,Visita lo Store di Tintark
"Delia Cosmetics - Siero illuminante - Vitamina C - Pelle con iperpigmentazione - Uniforma il colorito della pelle, illumina - leviga. Idratante - Vegano - 30ml",B09WDTVTCD,Italy,"✔ Siero illuminante VEGANO con Vtamina C ✔ PER CHI? Per pelli con discromie ✔ VANTAGGI: uniforma visivamente il colorito della pelle e la illumina. Riduce l'aspetto delle piccole rughe. Leviga la pelle e la idrata. ✔ INGREDIENTI ATTIVI: Contiene vitamina C liposomiale, peptide, pantenolo ✔ BENEFICI: Un effetto illuminato e uniforme del colorito della pelle. Pelle idratata e levigata con meno rughe","Tipo di pelle   Normale Vantaggi del prodotto   Idratante,Illuminante,Rughe Da utilizzare per   Faccia Marchio   Delia Cosmetics Forma articolo   Serum Caratteristica del materiale   Vegano Ingredienti attivi   retinolo, olio di olivello spinoso, vitamina C, vitamina E Usi consigliati per il prodotto   Falten Volume articolo   30 Millilitri Numero di articoli   1","3,90","3,90","0,30€",N/A,N/A,In stock,https://www.amazon.it/Delia-Cosmetics-illuminante-iperpigmentazione-Idratante/dp/B09WDTVTCD/ref=sr_1_20?keywords=cosmetics&qid=1701830902&sr=8-20,Visita lo Store di Delia Cosmetics
Essence cosmetics Camouflage+ Matt Corrector 23 Gel,B07YNZ7MFN,Italy,Essence CAMOUFLAGE+CORRECTOR MATTE 23,Forma articolo   Gel Colore   23 Tipo di pelle   Tutti i tipi di pelle Informazioni pacco   Bottiglia Marchio   Essence Cosmetics Vantaggi del prodotto   Antioxidant Dimensioni articolo: LxPxA   12 x 64 x 20 mm Numero di articoli   1 Conteggio unità   7.62 millilitro,"3,00",N/A,N/A,N/A,N/A,In stock,https://www.amazon.it/Ess-Camouflage-Matt-Corrector-23/dp/B07YNZ7MFN/ref=sr_1_21?keywords=cosmetics&qid=1701830902&sr=8-21,Marca: essence
"Eveline Cosmetics Gold Lift Expert Crema-Siero Multinutriente Con Crema Lifting Viso Antirughe Gold 24k 50+ Con Vitamine A, B, D | 50 ml | Siero Viso Per Pelli Mature E Sensibili | Giorno E Notte",B01N06HE4B,Italy,"LIFTING VISIBILE - La lussuosa crema multinutriente rassoda visibilmente la pelle e, grazie al complesso ANTI-AGE, stimola il lifting multidimensionale. RIEMPIMENTO RUGHE - PARTICELLE ORO PURO 24K hanno un effetto levigante e liftante sin dalla prima applicazione. Stimolano la sintesi del collagene e la ricostruzione dei tessuti di sostegno, grazie ai quali il contorno del viso viene ringiovanito e le rughe si attenuano. OLI PREZIOSI - La crema contiene olii pregiati: argan, noce di cespuglio, noce di candela che potenziano la rigenerazione cellulare e idratano in profondità la pelle. Arricchiscono la pelle di vitamine antietà: A, B, D ed E e componenti minerali. RIDUZIONE DEL COLORE - Il pro-retinolo A è una forma pura di vitamina A con un forte effetto levigante, migliorando il colore della pelle ed eliminando lo scolorimento. Ricostruisce i filamenti di collagene ed elastina, quindi leviga con precisione la pelle. GARANZIA DI RIMBORSO DI 30 GIORNI - Crediamo di avere il prodotto di altissima qualità sul mercato. Pertanto, il nostro prodotto è coperto da una garanzia di rimborso di 30 giorni che dimostra che siamo certi che ne sarai soddisfatto al 100%.",Marchio   Eveline Cosmetics Fragranza   Olio di argan Forma articolo   Crema Conteggio unità   219.7 grammo Numero di articoli   1 Da utilizzare per   Faccia Tipo di pelle   Matura Volume articolo   50 Millilitri Vantaggi del prodotto   Tratta le rughe Fascia d'età (descrizione)   Donna,Pagina1di1,N/A,N/A,N/A,N/A,In stock,https://www.amazon.it/Eveline-Cosmetics-Expert-Rassodante-Giorno/dp/B01N06HE4B/ref=sr_1_22?keywords=cosmetics&qid=1701830902&sr=8-22,Marca: Eveline Cosmetics
