Name,ASIN,Region,Description,Breakdown,Price,Deal Price,You saved,Rating,Rating count,Availability,Hyperlink,Store
"GYADA COSMETICS, Maschera Viso Pearl Powder Mask Rose, Indicata per Pelli Sensibili e Mature, Antietà e Cicatrizzante, per Pelle Morbida e Idratata, con Polvere di Perla e Olio di Macadamia, 75 ml",B09SGFV7VJ,Italy,"MASCHERA VISO: Dalle proprietà antietà e cicatrizzanti grazie al suo contenuto in amminoacidi, idrata e ripara la pelle. Riempie rughe e linee sottili. Adatta a tutti i tipi di pelle PROPRIETA': Trattamento efficace e veloce per rivitalizzare e idratare la pelle. Specifico per pelli sensibili e mature. Azione antietà e cicatrizzante. Per una pelle morbida ed idratata INGREDIENTI: A base di Polvere di Perla, Olio di Rosa Mosqueta, Olio di Macadamia e Acqua attiva di Rosa Damascena MODO D'USO: Applica la maschera su pelle pulita e asciutta. Tieni in posa 15 minuti e risciacqua. Si consiglia l’applicazione con il Mask Brush: il pennello per maschera viso GYADA COSMETICS: Cosmetici di alta qualità, creati attraverso l’utilizzo di formulazioni esclusivamente naturali, a base di estratti vegetali e biologici",,"13,99",N/A,N/A,N/A,N/A,In stock,https://www.amazon.it/COSMETICS-Maschera-Sensibili-Cicatrizzante-Macadamia/dp/B09SGFV7VJ/ref=sr_1_143?keywords=cosmetics&qid=1701830902&sr=8-143,Visita lo Store di GYADA COSMETICS
"GYADA COSMETICS, Maschera Capelli in Tessuto Sebo-equilibrante e Addolcente, Dona Morbidezza e Setosità, con Cuffia Termica, a Base di Ortica e Fieno Greco, 60 ml",B082N21KHQ,Italy,"MASCHERA CAPELLI: Maschera capelli sebo-equilibrante e addolcente. La cuffia sviluppa calore durante l’applicazione, favorendo l’assorbimento degli attivi. La cuffia è lavabile e riutilizzabile PROPRIETA': Per il trattamento di tutti i tipi di capelli. Ortica e Betulla sono seboequilibranti e purificanti. Olio di Macadamia, Fieno Greco e Pantenolo donano morbidezza e setosità ai capelli INGREDIENTI: A base di Ortica, Betulla, Olio di Macadamia, estratto di Fieno Greco e Pantenolo MODO D'USO: Prima o dopo lo shampoo, su capelli tamponati, applicare la cuffia con la linguetta verso la fronte. Rimuovere l’adesivo e chiudere bene. Massaggiare, far agire per 15 minuti, risciacquare GYADA COSMETICS: Cosmetici di alta qualità, creati attraverso l’utilizzo di formulazioni esclusivamente naturali, a base di estratti vegetali e biologici",Marchio   GYADA COSMETICS Vantaggi del prodotto   Calore Fascia d'età (descrizione)   Adulti Usi consigliati per il prodotto   Tutti I Tipi Di Capelli Conteggio unità   60.0 millilitro,"6,90","6,90","1,00€",N/A,N/A,In stock,https://www.amazon.it/GYADA-COSMETICS-Sebo-equilibrante-Addolcente-Morbidezza/dp/B082N21KHQ/ref=sr_1_145?keywords=cosmetics&qid=1701830902&sr=8-145,Visita lo Store di GYADA COSMETICS
Fumxin Lazy Makeup Bag Lazy Cosmetic Bag portatile grande borsa da viaggio Lazy Quick Coulisse Make up Bag Pouch Organizer per donne e ragazze,B08DJ33NF8,Italy,"Ampio spazio: questa trousse ha abbastanza spazio per riporre cosmetici e accessori cosmetici come rossetto, lucidalabbra, pennelli da trucco, ombretto, palette di trucco, spazzole, prodotti per la cura della pelle, smalti, strumenti per manicure, acqua per capelli, ecc. Materiale in velluto alla moda: questa elegante trousse per cosmetici è rifinita in un morbido velluto al tatto con romanticismo e femminilità, confortevole e resistente alla polvere, consente di passare da un viaggio d'affari, riunioni di lavoro e fuori servizio Portatile e veloce: il design portatile con coulisse consente di confezionare i tuoi oggetti in modo efficiente con stile. Basta allentare gli interruttori e tutto il trucco si diffonde quasi piatto, ma sicuro e sonoro nella borsa, quindi tirare i lacci e tutti i tuoi articoli da toeletta vengono riordinati in pochi secondi in una custodia ordinata e compatta. Perfetto per trasportare tutti i vostri trucchi e articoli da toeletta Design multifunzionale: si può usare come borsa per cosmetici, borsa per il trasporto, borsa da viaggio, borsa da bagno e cosmetici. Risolvi il problema del trasporto di piccoli oggetti Design alla moda, facile da usare: classico e generoso, facile da trasportare, progettato per persone pigri, di alta qualità, bello e pratico. Il design umanizzato ti offre un buon umore",,Pagina1di1,N/A,N/A,N/A,N/A,In stock,https://www.amazon.it/Fumxin-Cosmetic-portatile-Coulisse-Organizer/dp/B08DJ33NF8/ref=sr_1_147?keywords=cosmetics&qid=1701830902&sr=8-147,Marca: Fumxin
Cosmetic playlover (Vol. 4),8869138917,Italy,,,"7,50",N/A,N/A,N/A,N/A,In stock,https://www.amazon.it/Cosmetic-playlover-Vol-Sachi-Narashima/dp/8869138917/ref=sr_1_148?keywords=cosmetics&qid=1701830902&sr=8-148,N/A
"GYADA COSMETICS, Radiance Face Mask, Maschera Viso Illuminante, Idratante, Rende la Pelle Morbida, Levigata ed Elastica, Contrasta i Segni dell'Età e d'Espressione, a Base di Vitamina C, 25 ml",B082N16F4L,Italy,"MASCHERA VISO: Illumina, idrata e aiuta a stimolare il rinnovamento cellulare. La pelle risulta subito morbida, levigata ed il colorito più sano ed uniforme. Rende la pelle tonica ed elastica PROPRIETÀ: Svolge azione antiossidante e protegge dallo stress ossidativo. Contribuisce a trattare iperpigmentazioni legate all’invecchiamento, discromie cutanee, segni d’espressione, eccesso di sebo INGREDIENTI: Contiene Vitamina C, Acido Mandelico, Acido Lattobionico, Acido Ferulico, Melograno, Bacche di Goji, Uva Ursina MODO D'USO: 1-2 volte a settimana, applicare su viso pulito e asciutto una generosa quantità di prodotto e lasciare agire per 15-20 minuti. Rimuovere con acqua tiepida e con l’aiuto di una spugnetta GYADA COSMETICS: Cosmetici di alta qualità, creati attraverso l’utilizzo di formulazioni esclusivamente naturali, a base di estratti vegetali e biologici","Marchio   GYADA COSMETICS Forma articolo   Crema Vantaggi del prodotto   Idratante Fragranza   Melograno Tipo di pelle   Secca Caratteristica speciale   Alcohol-Free Conteggio unità   25.0 millilitro Numero di articoli   1 Usi consigliati per il prodotto   Face,Viso Volume articolo   25 Millilitri","6,90","6,90","6,21€",N/A,N/A,In stock,https://www.amazon.it/GYADA-COSMETICS-Illuminante-Idratante-dEspressione/dp/B082N16F4L/ref=sr_1_149?keywords=cosmetics&qid=1701830902&sr=8-149,Visita lo Store di GYADA COSMETICS
"GYADA COSMETICS, Maschera Capelli Disciplinante e Setificante. Effetto Districante, per Capelli Crespi e Indisciplinati, con Avena e Cheratina, 200 ml",B08ZKDPL9Q,Italy,"MASCHERA CAPELLI: Trattamento per capelli crespi e indisciplinati. Restituisce forza e morbidezza, riparando il capello dalle radici alle punte. Ha un potere districante immediato PROPRIETA': Maschera capelli disciplinante e setificante. Migliora capelli crespi e indisciplinati grazie a Proteine del Riso idrolizzate, Proteine del Grano, estratto di Avena, Cheratina e Pantenolo INGREDIENTI: A base di Proteine del Riso idrolizzate, Proteine del Grano, estratto di Avena, Cheratina e Pantenolo MODO D'USO: Distribuisci la maschera sulle lunghezze prima o dopo lo shampoo, lascia agire e risciacqua con cura. Potenzia l'effetto con la Cuffia Effetto Termo-Vapore di Gyada Cosmetics GYADA COSMETICS: Cosmetici di alta qualità, creati attraverso l’utilizzo di formulazioni esclusivamente naturali, a base di estratti vegetali e biologici",Marchio   GYADA COSMETICS Forma articolo   Mousse Caratteristica del materiale   Biologico Tipo di capelli   Crespi Vantaggi del prodotto   Districante,"16,99","16,99","15,29€",N/A,N/A,In stock,https://www.amazon.it/GYADA-COSMETICS-Maschera-Disciplinante-Setificante/dp/B08ZKDPL9Q/ref=sr_1_150?keywords=cosmetics&qid=1701830902&sr=8-150,Visita lo Store di GYADA COSMETICS
"GYADA COSMETICS, Gel Detergente Micellare Purificante, per la Pulizia del Viso, Indicato per Pelli Grasse, Miste e con Impurità, Azione Struccante per Makeup non Waterproof, con Aloe Vera, 200 ml",B07VVMBJHD,Italy,"GEL DETERGENTE PURIFICANTE: Ha un basso potere schiumogeno: deterge efficacemente facendo poca schiuma. Dopo l’uso, non sentirai la sensazione di pelle che tira. Rimuove le ultime tracce di make-up PROPRIETÀ: Gel detergente micellare indicato per la detersione del viso di pelli miste, grasse o con impurità. Può essere usato anche come struccante nel caso di make-up leggeri e non-waterproof INGREDIENTI: Contiene Aloe Vera, Bardana, Timo, Salvia, Amamelide, Menta, Eucalipto MODO D'USO: Distribuisci una piccola quantità di prodotto su tutto il viso e risciacqua GYADA COSMETICS: Cosmetici di alta qualità, creati attraverso l’utilizzo di formulazioni esclusivamente naturali, a base di estratti vegetali e biologici","Forma articolo   Gel Tipo di pelle   Grassa Marchio   GYADA COSMETICS Fragranza   Timo, Aloe vera, Salvia, Eucalipto, Menta Caratteristica del materiale   Vegano Numero di articoli   1 Conteggio unità   200.0 millilitro Caratteristica speciale   Alcohol-Free Quantità di articoli nella confezione   1 Da utilizzare per   Faccia","11,99","11,99","10,79€",N/A,N/A,In stock,https://www.amazon.it/GYADA-COSMETICS-Detergente-Purificante-Struccante/dp/B07VVMBJHD/ref=sr_1_151?keywords=cosmetics&qid=1701830902&sr=8-151,Visita lo Store di GYADA COSMETICS
"Delia Cosmetics - Tonic Me - Tonico Esfoliante - Pelle con Imperfezioni - Acido AHA e BHA, Acido Salicilico, Acido Glicolico, Acido Lattico - Deterge, Idrata, Rigenera - Cosmetici Vegani - 200ml",B09M7BK74C,Italy,"TONIC ME - Tonico esfoliante progettato per pelli con imperfezioni Ingredienti attivi: una miscela di acidi AHA e BHA, acido salicilico (deterge profondamente i pori), acido glicolico (ripristina il bagliore naturale, leviga), acido lattico (idrata fortemente), estratto di salice bianco (rafforza l'effetto esfoliante), estratto di liquirizia (lenisce le irritazioni, rigenera) VEGE - Un prodotto vegano con il 95% di ingredienti di origine naturale Cura notturna: grazie alle sue proprietà esfolianti, si consiglia l'uso di notte SCOPRI LA BELLA PELLE con i cosmetici della linea TONIC ME, vedi tutti i nostri prodotti per la pulizia e la cura su: amazon.co.uk/DeliaCosmetics","Marchio   Delia Cosmetics Forma articolo   Lozione Vantaggi del prodotto   Idratante Ingredienti attivi   aha Caratteristica del materiale   Vegano, Naturale Volume articolo   200 Millilitri Numero di articoli   1 Conteggio unità   200.0 millilitro","11,20","11,20","10,64€",N/A,N/A,In stock,https://www.amazon.it/Delia-Cosmetics-Esfoliante-Imperfezioni-Salicilico/dp/B09M7BK74C/ref=sr_1_152?keywords=cosmetics&qid=1701830902&sr=8-152,Visita lo Store di Delia Cosmetics
Reisenthel WO7052 toiletbag XL twist silver Unisex - Adulto COSMETICS Taglia Unica,B07SC3TJ6L,Italy,"Capiente borsa da toilette estremamente comoda nei lunghi viaggi Tessuto con tre volte più fili fini e multicolori, questo materiale robusto ha un aspetto particolarmente sofisticato e unico 1 ampio scomparto principale in materiale a rete con 4 tasche aggiuntive",,"37,59",N/A,N/A,N/A,N/A,In stock,https://www.amazon.it/Reisenthel-toiletbag-silver-Beauty-Centimeters/dp/B07SC3TJ6L/ref=sr_1_153?keywords=cosmetics&qid=1701830902&sr=8-153,Marca: Reisenthel
Roffatide Anime Sailor Moon Cosmetic Bag Donne Borsa per il Trucco Impermeabile Custodia per Organizer da Viaggio Rosa Medium,B0914RZ75L,Italy,"Materiale esterno impermeabile: pelle artificiale + tessuto in PVC. Interstrato antiurto: l'interfodera in nylon è riempita con fibre morbide, che possono proteggere efficacemente i cosmetici dalla rottura. Capacità media: 9,8 ''L * 6,3 '' W * 5,7 '' H / 25 * 16 * 14,5 cm. Peso: 270 g/ 9,5 once. Facile da riporre in valigia o sulla scrivania. Design a strati: doppia chiusura con cerniera in metallo. 6 fessure ed elastici di diverse dimensioni possono essere adattati a diverse dimensioni di pennelli da trucco e mantenuti fissi. L'area dello strato in PVC impermeabile è facile da pulire. Tema: l'iconico manico a fiocco rosso di Tsukino Usagi e l'esterno stampato. È un regalo perfetto per gli appassionati di Anime Sailor Moon.",,"27,99",N/A,N/A,N/A,N/A,In stock,https://www.amazon.it/Roffatide-Cosmetici-Impermeabile-Organizzatore-Immagazzinaggio/dp/B0914RZ75L/ref=sr_1_154?keywords=cosmetics&qid=1701830902&sr=8-154,Marca: Roffatide
"EASTPAK Mavis, Accessori da viaggio - Cosmetics Unisex - Adulto, Grigio (Black Denim), 17.5 x 26 x 10",B07X1T5QPG,Italy,"Facile da pulire Due ampi scomparti con tasche interne Altezza: 17.5 cm, larghezza: 26 cm, profondità: 10 cm Realizzato in nylon (60%) e poliestere (40%) Appendibile con gancio",,"40,00",N/A,N/A,N/A,N/A,In stock,https://www.amazon.it/Eastpak-Mavis-Borsa-Toilette-Blackout/dp/B07X1T5QPG/ref=sr_1_155?keywords=cosmetics&qid=1701830902&sr=8-155,Visita lo Store di EASTPAK
"Freshly Cosmetics - Olio Corpo Nutriente 100% Naturale Golden Radiance Body Oil, 100ml",N/A,Italy,Nutre la pelle in profondità. Aumenta l’elasticità stimolando la sintesi del collagene Previene e migliora l’aspetto di cicatrici e smagliature. Protegge la pelle dal fotoinvecchiamento Texture vellutata che non unge e si assorbe in fretta 100% d’ingredienti naturali Non contiene oli sintetici né siliconi,"Marchio   Freshly Cosmetics Fragranza   Bergamotto Forma articolo   Olio Ingredienti attivi     Astaxantina, olio di marula, olio di semi di chia, olio di rosa mosqueta, olio di jojoba bio, olio di babassu bio, olio di macadamia, olio di nocciola bio, olio di avocado, olio di papavero bio...   Mostra altro Conteggio unità   100.0 millilitro Numero di articoli   1 Da utilizzare per   Corpo Tipo di pelle   Tutti i tipi di pelle Volume articolo   100 Millilitri Fascia d'età (descrizione)   Adultos","26,95","26,95","25,60€",N/A,N/A,In stock,https://www.amazon.it/sspa/click?ie=UTF8&spc=MTozNDI4MTAyMDQxNzIxNzA0OjE3MDE4MzA5MDI6c3BfYXRmX25leHQ6MjAxMTY5MjYxMzI1OTg6OjA6Og&url=%2FFreshly-Cosmetics-Nutriente-Naturale-Radiance%2Fdp%2FB0B8SSHSVJ%2Fref%3Dsr_1_147_sspa%3Fkeywords%3Dcosmetics%26qid%3D1701830902%26sr%3D8-147-spons%26sp_csd%3Dd2lkZ2V0TmFtZT1zcF9hdGZfbmV4dA%26psc%3D1,Marca: Freshly Cosmetics
"reisenthel Wrapcosmetic Modern, Einheitsgröße",B08WDJ8NNF,Italy,,,,N/A,N/A,N/A,N/A,In stock,https://www.amazon.it/reisenthel-wrapcosmetic-Accessori-viaggio-personale/dp/B08WDJ8NNF/ref=sr_1_149?keywords=cosmetics&qid=1701830902&sr=8-149,N/A
Sheila Cosmetics MyBrowPencil Matita Sopracciglia con Formula Rigida Dermatologicamente Testata | Made in Italy (02 Medium Brown),B0BKWYQGGJ,Italy,"Matita professionale con formula rigida: riempie, disegna e definisce le sopracciglia per un finish preciso e naturale La punta rigida permette un'applicazione modulabile e assicura un tratto definito, durevole e senza sbavature La ricca presenza di cere consente alla texture di legarsi al pelo sopraccigliare, di pigmentarlo e modellarlo per un risultato definito e ordinato Il pratico scovolino, integrato sul fondo della matita, permette di pettinare e modellare perfettamente le sopracciglia Temperino incluso","Marchio   Sheila Cosmetics Forma articolo   Matita Colore   02 Castane Caratteristica speciale   Formula vegana, Non testato su animali Caratteristica del materiale   Naturale Peso articolo   14 Grammi Dimensioni articolo: LxPxA   17,2 x 1,7 x 2,2 cm Numero di articoli   1 Conteggio unità   1.00 unità","7,68","7,68","7,30€",N/A,N/A,In stock,https://www.amazon.it/Sheila-Cosmetics-MyBrowPencil-Sopracciglia-Dermatologicamente/dp/B0BKWYQGGJ/ref=sr_1_150?keywords=cosmetics&qid=1701830902&sr=8-150,Visita lo Store di Sheila Cosmetics
"Luvia Cosmetics Pennelli Make Up Professionali Set Prime Vegan Pro, 12 Pennelli Da Trucco Con Contenitore Per Pennelli, Spugna E Tappetino Per La Pulizia Per Pennelli, Madreperla/Caffè",B08G557QL3,Italy,"SET DI PENNELLI PER IL MAKE-UP PROFESSIONALE: Il set di pennelli da 12 pezzi in bianco contiene tutti i pennelli essenziali per il trucco. L'accessorio per eccellenza per il make-up, sia per il trucco da sposa che per le feste o per il look di tutti i giorni. CONSIGLIATO DAGLI ARTISTI DEL MAKE-UP: I pennelli cosmetici vegani di Luvia sono precisi e scorrevoli: il set di pennelli professionali è consigliato per un'applicazione uniforme di fondotinta, cipria, fard o ombretto. Con i pennelli giusti per ogni prodotto, puoi ottenere un look perfetto in pochi passi. SETOLE VEGANE “NURAI”: Il segreto dei pennelli da trucco Luvia sono le setole sintetiche di alta qualità. Le raffinate setole raccolgono perfettamente fondotinta, cipria, ecc. e distribuiscono il prodotto in modo impeccabile e uniforme, - per un risultato di make-up splendido. Luvia offre i pennelli perfetti per sfumare i cosmetici. MORBIDI E DELICATI PER LA PELLE: I pennelli vegani di Luvia sono ultra delicati e quindi perfetti per le pelli sensibili e per chi soffre di allergie. Le setole sintetiche dei pennelli hanno una superficie fibrosa raffinata, sono delicati sulla pelle e prevengono gli arrossamenti. FACILI DA PULIRE E A LUNGA DURATA: Niente più macchie della pelle: la speciale setola del pennello Luvia è facile da pulire e garantisce la massima igiene. La superficie liscia delle fibre sintetiche impedisce a residui, sporco e pelle morta di penetrare nei pennelli. Tutti i pennelli per il trucco sono ben legati, senza spazi vuoti. Le setole non diventano fragili e rimangono sempre morbide ed elastiche. Nessuna rottura delle setole, nessuna perdita! REGALO PER LE AMANTI DEL MAKE-UP: Premiate le vostre persone preferite con questo set di make-up di alta qualità! Confezionato con cura, il kit make-up all-in-one è pronto per essere regalato! Questo rende i pennelli professionali il regalo perfetto per le donne e per gli uomini esperti di cosmetica. Sorprendete i vostri cari con un set di pennelli per il trucco lussuoso ma conveniente. OMAGGI ESCLUSIVI: Il lussuoso tubo per pennelli è il contenitore ideale per pennelli e strumenti per il trucco. Il contenitore è diviso in due parti e può essere comodamente chiuso e portato con sé durante i viaggi. Il design elegante rende il porta pennello un elemento glamour sul tavolo da trucco o in viaggio. Con il pratico tappetino per la pulizia dei pennelli potrete pulire tutti i vostri pennelli da trucco in modo rapido e igienico!","Materiale delle setole   Nurai Marchio   Luvia Cosmetics Usi consigliati per il prodotto     Per evidenziare, Per ombretto, Per l'eyelining, Per Blush, Per l'abbronzatura, Per fissare la polvere, Per Foundation, Per Primer, Per nascondere   Mostra altro Colore   madreperla / caffè Materiale   (Legno","44,99",N/A,N/A,N/A,N/A,In stock,https://www.amazon.it/Luvia-pennelli-contenitore-tappetino-madreperla/dp/B08G557QL3/ref=sr_1_151?keywords=cosmetics&qid=1701830902&sr=8-151,Marca: Luvia Cosmetics
Cosmetic playlover (Vol. 4),8869138917,Italy,,,"7,50",N/A,N/A,N/A,N/A,In stock,https://www.amazon.it/Cosmetic-playlover-Vol-Sachi-Narashima/dp/8869138917/ref=sr_1_152?keywords=cosmetics&qid=1701830902&sr=8-152,N/A
Lord of The Rings Cosmetic Bag Eye of Sauron,B09PRRY9R8,Italy,,,"15,00",N/A,N/A,N/A,N/A,In stock,https://www.amazon.it/Lord-Rings-Cosmetic-Bag-Sauron/dp/B09PRRY9R8/ref=sr_1_153?keywords=cosmetics&qid=1701830902&sr=8-153,Marca: SD TOYS
Fumxin Lazy Makeup Bag Lazy Cosmetic Bag portatile grande borsa da viaggio Lazy Quick Coulisse Make up Bag Pouch Organizer per donne e ragazze,B08DJ33NF8,Italy,"Ampio spazio: questa trousse ha abbastanza spazio per riporre cosmetici e accessori cosmetici come rossetto, lucidalabbra, pennelli da trucco, ombretto, palette di trucco, spazzole, prodotti per la cura della pelle, smalti, strumenti per manicure, acqua per capelli, ecc. Materiale in velluto alla moda: questa elegante trousse per cosmetici è rifinita in un morbido velluto al tatto con romanticismo e femminilità, confortevole e resistente alla polvere, consente di passare da un viaggio d'affari, riunioni di lavoro e fuori servizio Portatile e veloce: il design portatile con coulisse consente di confezionare i tuoi oggetti in modo efficiente con stile. Basta allentare gli interruttori e tutto il trucco si diffonde quasi piatto, ma sicuro e sonoro nella borsa, quindi tirare i lacci e tutti i tuoi articoli da toeletta vengono riordinati in pochi secondi in una custodia ordinata e compatta. Perfetto per trasportare tutti i vostri trucchi e articoli da toeletta Design multifunzionale: si può usare come borsa per cosmetici, borsa per il trasporto, borsa da viaggio, borsa da bagno e cosmetici. Risolvi il problema del trasporto di piccoli oggetti Design alla moda, facile da usare: classico e generoso, facile da trasportare, progettato per persone pigri, di alta qualità, bello e pratico. Il design umanizzato ti offre un buon umore",,Pagina1di1,N/A,N/A,N/A,N/A,In stock,https://www.amazon.it/Fumxin-Cosmetic-portatile-Coulisse-Organizer/dp/B08DJ33NF8/ref=sr_1_154?keywords=cosmetics&qid=1701830902&sr=8-154,Marca: Fumxin
"GYADA COSMETICS, Maschera Capelli in Tessuto Sebo-equilibrante e Addolcente, Dona Morbidezza e Setosità, con Cuffia Termica, a Base di Ortica e Fieno Greco, 60 ml",B082N21KHQ,Italy,"MASCHERA CAPELLI: Maschera capelli sebo-equilibrante e addolcente. La cuffia sviluppa calore durante l’applicazione, favorendo l’assorbimento degli attivi. La cuffia è lavabile e riutilizzabile PROPRIETA': Per il trattamento di tutti i tipi di capelli. Ortica e Betulla sono seboequilibranti e purificanti. Olio di Macadamia, Fieno Greco e Pantenolo donano morbidezza e setosità ai capelli INGREDIENTI: A base di Ortica, Betulla, Olio di Macadamia, estratto di Fieno Greco e Pantenolo MODO D'USO: Prima o dopo lo shampoo, su capelli tamponati, applicare la cuffia con la linguetta verso la fronte. Rimuovere l’adesivo e chiudere bene. Massaggiare, far agire per 15 minuti, risciacquare GYADA COSMETICS: Cosmetici di alta qualità, creati attraverso l’utilizzo di formulazioni esclusivamente naturali, a base di estratti vegetali e biologici",Marchio   GYADA COSMETICS Vantaggi del prodotto   Calore Fascia d'età (descrizione)   Adulti Usi consigliati per il prodotto   Tutti I Tipi Di Capelli Conteggio unità   60.0 millilitro,"6,90","6,90","1,00€",N/A,N/A,In stock,https://www.amazon.it/GYADA-COSMETICS-Sebo-equilibrante-Addolcente-Morbidezza/dp/B082N21KHQ/ref=sr_1_155?keywords=cosmetics&qid=1701830902&sr=8-155,Visita lo Store di GYADA COSMETICS
"Alonia Cosmetics Ombrello Pioggia,Ombrellino Pieghevole Automatico Anti vento,12 Stecche Rinforzate apertura 104 Cm, Asciugatura Rapida Ombrello Grande portatile resistente",B0CLKJNRVD,Italy,,,"14,99",N/A,N/A,N/A,N/A,In stock,https://www.amazon.it/Alonia-Cosmetics-Ombrellino-Pieghevole-Asciugatura/dp/B0CLKJNRVD/ref=sr_1_156?keywords=cosmetics&qid=1701830902&sr=8-156,Marca: Alonia Cosmetics
"GYADA COSMETICS, Hyalurvedic Impacco Ayurvedico Purificante, Trattamento Professionale per Capelli Grassi, Sottili e Sfibrati, Contrasta l'Effetto Crespo, con Neem, Moringa, Hennè Neutro, 200 ml",B0968VGJGD,Italy,"TRATTAMENTO PURIFICANTE: Trattamento potenziato ad azione purificante per un risultato professionale sui tuoi capelli. Concentrato di Erbe Ayurvediche; contiene l'innovativo 3D Hair Complex PROPRIETÀ: Maschera concentrata per il trattamento dei capelli. Ideale per capelli grassi, sottili e sfibrati. 3D Hair Complex aiuta a contrastare l'effetto crespo e a idratare la fibra capillare INGREDIENTI: Acido Ialuronico, Neem, Moringa, Cassia, Hennè Neutro. Il Neem è noto per le proprietà purificanti e sebo-regolatrici, la Moringa ha azione detox. Arricchito con estratto di “Pepe Cinese” MODO D'USO: Dopo lo shampoo, sui capelli bagnati e tamponati, distribuire l’impacco in modo uniforme sulle lunghezze. Lasciare agire per almeno 15 minuti. Risciacquare e procedere con la piega GYADA COSMETICS: Cosmetici di alta qualità, creati attraverso l’utilizzo di formulazioni esclusivamente naturali, a base di estratti vegetali e biologici","Marchio   GYADA COSMETICS Tipo di capelli   Sottili, Danneggiati, Crespi, Grassi Vantaggi del prodotto   Capelli grassi Fascia d'età (descrizione)   Adulti Usi consigliati per il prodotto   Capelli Grassi","17,99",N/A,N/A,N/A,N/A,In stock,https://www.amazon.it/GYADA-COSMETICS-Hyalurvedic-Ayurvedico-Purificante/dp/B0968VGJGD/ref=sr_1_157?keywords=cosmetics&qid=1701830902&sr=8-157,Visita lo Store di GYADA COSMETICS
"GYADA COSMETICS, Cristalli Liquidi, Termoprotettore, per Capelli Spenti e Sfibrati, ad Azione Illuminante, Rende i Capelli Setosi e Lucidi, con Olio di Lino e Argan, 100ml",B07W22QGGW,Italy,"CRISTALLI LIQUIDI: Concentrato di oli vegetali puri per il trattamento di capelli aridi, sfibrati e spenti. Ad azione illuminante. Protegge dagli agenti esterni e dal calore del phon PROPRIETÀ: Esalta la brillantezza dei capelli e ne contrasta le doppie punte, ridando immediata lucentezza e setosità INGREDIENTI: A base di Olio di Lino, Mandorle, Vinaccioli, Argan, Tocoferolo e Pantenolo MODO D'USO: Distribuisci il prodotto sul palmo della mano e distribuisci uniformemente su capelli umidi e tamponati prima di asciugarli. Può essere usato sui capelli asciutti per lucidare la chioma GYADA COSMETICS: Cosmetici di alta qualità, creati attraverso l’utilizzo di formulazioni esclusivamente naturali, a base di estratti vegetali e biologici",Vantaggi del prodotto   Anti-crespo Tipo di capelli   Secchi Fragranza   Argan Volume liquido   100 Millilitri Forma articolo   Nebulizzatore Marchio   GYADA COSMETICS Numero di articoli   1 Conteggio unità   100.0 millilitro Volume articolo   100 Millilitri,"14,90","14,90","2,00€",N/A,N/A,In stock,https://www.amazon.it/GYADA-COSMETICS-Cristalli-Termoprotettore-Illuminante/dp/B07W22QGGW/ref=sr_1_158?keywords=cosmetics&qid=1701830902&sr=8-158,Visita lo Store di GYADA COSMETICS
